년도	제목	장르	가사
2017	가을 아침	포크/블루스	이른 아침 작은 새들 노랫소리 들려오면 언제나 그랬듯 아쉽게 잠을 깬다 창문 하나 햇살 가득 눈부시게 비쳐오고 서늘한 냉기에 재채기할까 말까 음 눈 비비며 빼꼼히 창밖을 내다보니 삼삼오오 아이들은 재잘대며 학교 가고 산책 갔다 오시는 아버지의 양손에는 효과를 알 수 없는 약수가 하나 가득 음 딸각딸각 아침 짓는 어머니의 분주함과 엉금엉금 냉수 찾는 그 아들의 게으름이 상큼하고 깨끗한 아침의 향기와 구수하게 밥 뜸드는 냄새가 어우러진 가을 아침 내겐 정말 커다란 기쁨이야 가을 아침 내겐 정말 커다란 행복이야 응석만 부렸던 내겐 파란 하늘 바라보며 커다란 숨을 쉬니 드높은 하늘처럼 내 마음 편해지네 텅 빈 하늘 언제 왔나 고추잠자리 하나가 잠 덜 깬 듯 엉성히 돌기만 비잉비잉 음 토닥토닥 빨래하는 어머니의 분주함과 동기동기 기타 치는 그 아들의 한가함이 심심하면 쳐대는 괘종시계 종소리와 시끄러운 조카들의 울음소리 어우러진 가을 아침 내겐 정말 커다란 기쁨이야 가을 아침 내겐 정말 커다란 행복이야 응석만 부렸던 내겐 가을 아침 내겐 정말 커다란 기쁨이야 가을 아침 내겐 정말 커다란 행복이야 뜬구름 쫓았던 내겐 이른 아침 작은 새들 노랫소리 들려오면 언제나 그랬듯 아쉽게 잠을 깬다 창문 하나 햇살 가득 눈부시게 비쳐오고 서늘한 냉기에 재채기할까 말까 음
2017	매일 그대와	포크/블루스	매일 그대와 아침 햇살 받으며 매일 그대와 눈을 뜨고파 매일 그대와 도란 도란 둘이서 매일 그대와 얘기하고파 새벽비 내리는 거리도 저녁노을 불타는 하늘도 우리를 둘러싼 모든 걸 같이 나누고파 매일 그대와 밤의 품에 안겨 매일 그대와 잠이 들고파 매일 그대와 새벽비 내리는 거리도 저녁노을 불타는 하늘도 우리를 둘러싼 모든 걸 같이 나누고파 매일 그대와 아침 햇살 받으며 매일 그대와 눈을 뜨고파 정말 매일 그대와 진짜 잠이 들고파 몹시 매일 그대와 엄청 얘기 하고파 정말 매일 그대와 매일 그대와
2017	썸 탈꺼야	포크/블루스	표현이 서툰 것도 잘못인가요 나 차가운 도시에 따뜻한 여잔데 그냥 좋아한단 말도 안 되는가요 솔직하게 난 말하고 싶어요 사라져 아니 사라지지 마 네 맘을 보여줘 아니 보여주지 마 하루 종일 머릿속에 네 미소만 우리 그냥 한번 만나볼래요 나 오늘부터 너랑 썸을 한번 타볼 거야 나 매일매일 네게 전화도 할 거야 밀가루 못 먹는 나를 달래서라도 너랑 맛있는 걸 먹으러 다닐 거야 넘넘 스윗한 넌 정말 달콤한 걸 넘넘 스윗한 넌 그냥 좋아한단 말도 안 되는가요 솔직하게 난 말하고 싶어요 사라져 아니 사라지지 마 네 맘을 보여줘 아니 보여주지 마 하루 종일 머릿속에 네 미소만 우리 그냥 한번 만나볼래요 나 오늘부터 너랑 썸을 한번 타볼 거야 나 매일매일 네게 전화도 할 거야 밀가루 못 먹는 나를 달래서라도 너랑 맛있는 걸 먹으러 다닐 거야 사랑은 이렇게 생기는 게 아니겠어 어쩌면 내 맘의 반쪽을 네게 걸어보는 건데 나는 오늘도 네게 차일 것만 같아도 난 한번 더 너에게 다시 달려가 볼 거야 나 오늘부터 너랑 썸을 한번 타볼 거야 나 매일매일 네게 전화도 할 거야 매운 거 못 먹는 나를 달래서라도 너랑 맛있는 걸 먹으러 다닐 거야 나도 그 애처럼 좋아요 좀 눌러줘 나도 너랑 말 좀 할 수 있게 해줘 나는 풀이 죽어서 오늘도 포기하고 뒤를 돌아볼 때쯤 나를 붙잡는 넌 넘넘 스윗한 넌 정말 달콤한 걸 넘넘 스윗한 넌
2017	나의 사춘기에게	포크/블루스	나는 한때 내가 이 세상에 사라지길 바랬어 온 세상이 너무나 캄캄해 매일 밤을 울던 날 차라리 내가 사라지면 마음이 편할까 모두가 날 바라보는 시선이 너무나 두려워 아름답게 아름답던 그 시절을 난 아파서 사랑 받을 수 없었던 내가 너무나 싫어서 엄마는 아빠는 다 나만 바라보는데 내 마음은 그런 게 아닌데 자꾸만 멀어만 가 어떡해 어떡해 어떡해 어떡해 시간이 약이라는 말이 내게 정말 맞더라고 하루가 지나면 지날수록 더 나아지더라고 근데 가끔은 너무 행복하면 또 아파올까 봐 내가 가진 이 행복들을 누군가가 가져갈까 봐 아름다운 아름답던 그 기억이 난 아파서 아픈 만큼 아파해도 사라지지를 않아서 친구들은 사람들은 다 나만 바라보는데 내 모습은 그런 게 아닌데 자꾸만 멀어만 가 그래도 난 어쩌면 내가 이 세상에 밝은 빛이라도 될까 봐 어쩌면 그 모든 아픔을 내딛고서라도 짧게 빛을 내볼까 봐 포기할 수가 없어 하루도 맘 편히 잠들 수가 없던 내가 이렇게라도 일어서 보려고 하면 내가 날 찾아줄까 봐 아아아아아아아 아아아아아아아 아아아아아아아 아아아아아아아 얼마나 얼마나 아팠을까 얼마나 얼마나 아팠을까 얼마나 얼마나 얼마나 바랬을까
2017	Blue	포크/블루스	음음음음음 yeah 음음음음음 So blue blue blue blue blue yeah blue blue blue blue blue 지금 내 맘의 색깔은 blue 기분이 별로 안 좋아 알잖아 나 좀 예민해 네게만 참 까다롭잖아 잘 지냈냐 물어보네 Do you 난 아냐 지금보다 조금 더 나아졌으면 해 미안해 미워해 조금은 좋아해 좀 야윈 모습이 안쓰럽기는 해도 나는 또 아직도 네 눈을 마주칠 수 없는 걸 넌 여전히 내가 참 미워 보이잖아 파랗게 blue blue 우리가 칠해지네 서로의 맘도 파랗게 멍들어갈 때 내 맘은 true true 너와 함께 있을 땐 사랑받던 모습이 그토록 아름다웠는데 음음음음음 yeah 음음음음음 So blue blue blue blue blue yeah blue blue blue blue blue 지금 내 맘의 색깔은 blue 기분이 별로 안 좋아 알잖아 나 좀 피곤해 네게만 참 까다롭잖아 잘 지냈냐 물어봐도 Do you 난 아냐 지금보다 조금 더 아파했으면 해 미안해 미워해 아직 널 좋아해 네 지친 모습이 안쓰럽기는 해도 나는 또 아직도 네 눈을 마주칠 수 없는 걸 넌 여전히 내가 참 미워 보이잖아 파랗게 blue blue 우리가 칠해지네 서로의 맘도 파랗게 멍들어갈 때 내 맘은 true true 너와 함께 있을 땐 사랑받던 모습이 그토록 아름다웠는데 미안해 미워해 조금은 좋아해 미안해 미워해 아직 널 좋아해 파랗게 blue blue 우리가 칠해지네 서로의 맘도 파랗게 멍들어갈 때 내 맘은 true true 너와 함께 있을 땐 사랑받던 모습이 그토록 아름다웠는데 음음음음음 yeah 음음음음음 So blue blue blue blue blue yeah blue blue blue blue blue
2017	고쳐주세요	포크/블루스	기운이 하나도 없어 밥도 잘 넘어가질 않아 세상에서 젤 슬픈 얼굴로 거리를 걷고 머릿속에 먹구름이 좀처럼 해가 뜨질 않아 눈 밑이 점점 어두워져요 어떡해 나를 고쳐주세요 Make me love Make me love 환하게 웃어줄래요 너의 미소에 나의 하루가 밝아질 거에요 Let me love Let me love 날 좋아해줘요 온 세상이 아주 소중해질 거라구요 우 우 Oh make me love you 시간을 잡아두고 싶어 혼자선 하루가 아쉬워 지루해진 오후를 견디다 잠들긴 싫어 내 맘이 말라가고 있어 좀처럼 비가 오질 않아 눈빛이 점점 흐릿해져요 어떡해 나를 고쳐주세요 Make me love Make me love 환하게 웃어줄래요 너의 미소에 나의 하루가 밝아질 거에요 Let me love Let me love 날 좋아해줘요 온 세상이 아주 소중해질 거라구요 F i x me 구름 한점 없는 날의 des tiny 스물 하나 둘 셋 잡아주던가 그냥 보내주던가 애매한 상태니 속앓이 하는 상대 It’s me 단발머리 고집쟁이 나는 더운 여름에도 길게 해 한 발자국 더 나아 가려 해 너의 꿈에 Make me love Make me love 놀라지 말아줄래요 너의 꿈속에 몰래 들어가 기다릴 거에요 Let me love Let me love 날 좋아해줘요 내 모든 게 아주 새로워질 거라구요 우 우 Oh make me love you 우 우 Oh make me love you
2017	상상	포크/블루스	지루해 혼자 집 지키는 강아지마냥 누가 오길 기다리고 귀 쫑긋 세우고 있는 것도 엎드려도 봤다가 소파에 기대어 보고 배경음악은 발자국 소리 왜인지는 모르지만 사실 알고 있지만 나는 아닌 척 그렇게 등 돌리다 남모르게 웃어 티 나게 고개를 돌린 날 아는데 왜 아무렇지 않아요 무심한 표정을 하는 넌 정말 아무렇지 않나요 물어볼 게 있어 나랑 얘기할래요 내일부터 손잡으면 안 돼요 난 말야 머릿속을 떠나지를 않았어 일기장도 모자라서 하루 온종일 생각했어 어두워진 지금이 몇 신지도 모를 만큼 배경음악은 발자국 소리 왜인지는 모르지만 사실 알고 있지만 나는 아닌 척 그렇게 등 돌리다 남모르게 웃어 티 나게 고개를 돌린 날 아는데 왜 아무렇지 않아요 무심한 표정을 하는 넌 정말 아무렇지 않나요 하루만 눈이 감기는 밤 꿈속에 내가 나오게 해줘요 무심한 표정을 하는 넌 나와 같은 생각하나요 물어볼 게 있어 나랑 얘기할래요 내일부터 손잡으면 안 돼요
2018	#첫사랑	포크/블루스	어릴 때 넌 키도 작고 빼빼 말랐지 기억나 난 knock 그런 니가 괜히 맘에 들어 두드려보지만 yeah 짓궂게 놀려주는 게 나름 나의 맘이었는데 Why- Don't you know 그런 채로 졸업식 But these days 너의 소식이 어디서 타고 오는 건지 훌쩍 커버린 너는 왜 땜에 멋진 건지 내 timeline에 나타나는 너의 시간이 내 시간을 다 훔쳐가 yeah Oh winter night when I meet you 나 너를 만나면 그 어릴 때 뭐 모를 때 사실 널 좋아했다고 말해줄 거야 괜히 널 보면 못되게 굴었었다고 말해줄 거야 너도 그 날로 돌아가 솔직 해줄래 어릴 때 넌 숫기 없고 조용했었지 기억나 근데 어쩜 하는 말마다 왜 그렇게 예쁘게 하는데 이제는 놀릴 수 없이 커져버린 너의 어깨가 날 설레게 해 따뜻할 것 같아 Oh winter night when I meet you 나 너를 만나면 그 어릴 때 뭐 모를 때 사실 널 좋아했다고 말해줄 거야 괜히 널 보면 못되게 굴었었다고 말해줄 거야 너도 그 날로 돌아가 솔직 해줄래 널 좋아했던 그때가 그리운 걸까 아님 지금도 떨리는 걸까 yeah 너가 걸어오고 있어 몸이 얼어붙어 아무 말도 못 하겠어 Oh winter night when I meet you 흰 눈이 내리면 난 아직도 널 보는 게 사실 두근거린다고 말해줄 거야 이제 널 보면 예쁘게 웃어준다고 말해줄 거야 너도 그 날로 돌아가 솔직 해줄래
2018	Dejavu	포크/블루스	Monday to Sunday 늘 바쁘죠 어제가 오늘인 건지 내일은 또 오늘 같겠죠 눈을 감았다 뜨면 이건 마치 Like a Dejavu 다시 보기 하는 거죠 입고 있던 옷만 바뀐 채 똑같은 하루를 살죠 어지럽혀진 방은 말라버린 화분은 언제부터였던 걸까요 하고 싶었던 말이 너무나 많았었는데 아무런 생각도 나질 않네요 음 Today like yesterday 우우우우우 Dejavu 정신이 없는 건지 마음이 없는 건지 헷갈리게 되죠 뜨겁던 금요일은 설레던 토요일은 언제였었는지 I’m buring out falling out 사라져갈까요 어제와는 달라진 오늘이 될까요 어지럽혀진 방은 말라버린 화분은 언제부터였던 걸까요 하고 싶었던 말이 너무나 많았었는데 아무런 생각도 나질 않네요 I don’t know what to do Would it be alright 매일이 꿈인 것처럼 Dejavu Dejavu Dejavu I don’t know what to do Would it be alright 마지막 꿈인 것처럼 Dejavu Dejavu Dejavu oh everyday 어지럽혀진 맘은 갇혀버린 하루는 언제부터였던 걸까요 하고 싶었던 말이 너무나 많았었는데 아무런 생각도 나질 않네요 음 Today like yesterday 우우우우우 Dejavu
2018	매트리스	포크/블루스	오늘밤 너는 나와 이불 속에 들어가 아무것도 하지 말고 그냥 바라보다가 웃음을 참지 못하고 먼저 깜빡인 사람 그사람이 졌으니까 마실 것 좀 가져와 새로 산 침대와 그 속의 우리가 세상의 전부인 거라면 그럼 우린 나갈 필요 없으니까 난 어설픈 말장난을 좀 해보려다가 어느새 잠든 너의 얼굴이 뚫어져라 괜히 감동 하고 있어 굳이 말로 하지 않아도 자꾸만 나도 모르게 이불을 끌어 오는 이유는 모르겠지만 다신 그러지 않을게 눈 앞에 계속 있어줘 내가 귀찮을 만큼 다리 올려놔도 좋아 내겐 가벼우니까 새로 산 침대와 그 속의 우리가 세상의 전부인 것처럼 그럼 우린 잠들 수도 없으니까 난 어설픈 말장난을 또 해보려다가 그새 또 잠든 너의 얼굴이 뚫어져라 다시 감동하고 있어 굳이 말로 하지 않아도 난 이러고 계속 있어도 되는 걸까 넌 또다른 많은 밤들을 나와 있어 줄까 제발 날 보고 또 웃어 굳이 말로 하지 않아도 오늘은 내가 유난히 말이 많은 것 같아 몰라 같이 있으니까 괜히 들떠있나봐 뒤에서 날 꼭 안아줘 어깨에 턱을 괴고 그리곤 가만히 있어 잠들 것 같으니까
2019	그러나	포크/블루스	오랜만에 나를 마주치는 어느정도 가까운 사람들이 나에게 다가와 인사하며 꺼내는 너의 얘기 누구와 만나 무얼 했는지 너 요즘은 어떤지 살만 한지 소식과 근황을 전하고 나면 내 걱정으로 마무리 그럼 나는 웃으면서 다행이네 나 괜찮아 문제 없어 그러나 사실은 슬프게도 나는 괜찮지 않지 매일밤 매일밤 눈 감으면 꿈 속의 널 죽도록 미워하지 언짢은 기분을 내비치며 널 나쁘게 말하는 친구에게 아냐 이제와 다시 돌이켜 보면 오히려 고맙다고 다시 나는 웃으면서 다행이네 나 괜찮아 문제 없어 그러나 사실은 슬프게도 전혀 괜찮지 않지 매일밤 매일밤 어김없이 꿈 속의 널 마주하지 그러나 누구나 알고 있지 나는 괜찮지 않지 매일밤 매일밤 눈 감으면 꿈 속의 널 죽도록 미워하지 그럼 나는 어떡하지 하루하루 거짓말은 쌓여가지
2019	나만, 봄	포크/블루스	안돼 그만둬 거기까지 해 더 다가가면 너 정신 못 차려 안돼 그만해 꽃은 넣어둬 그냥 좀 바람이 불게 놔줘 왜 그럴까 사람들은 그냥 봄기운이 좋아 눈치 없이 밖을 나가는 걸까 왜 이럴까 뭐가 설렌다고 봄바람이 좋아 내 맘도 모르고 더 불어와 flower sunshine 완벽한 하루를 사실 너와 걸을 수 있다면 얼마나 좋을까 좋아한다고 말하기가 무서워서 네 곁을 맴돌고 있는 난 벚꽃도 뭐고 다 필요 없어 나는 네 곁에 있고 싶어 딱 붙어서 봄이 지나갈 때까지 다른 사람 다 사라져라 나만 봄 왜 그럴까 사람들은 그냥 봄기운이 좋아 눈치 없이 밖을 나가는 걸까 왜 이럴까 뭐가 설렌다고 봄바람이 좋아 내 맘도 모르고 더 불어와 flower sunshine 완벽한 하루를 사실 너와 걸을 수 있다면 얼마나 좋을까 좋아한다고 말하기가 무서워서 네 곁을 맴돌고 있는 난 벚꽃도 뭐고 다 필요 없어 나는 네 곁에 있고 싶어 딱 붙어서 봄이 지나갈 때까지 다른 사람 다 사라져라 언제 봄이 왔는지 내 맘도 모르고 봄바람이 자꾸만 불어와 네 곁에 딱 붙어서 떨어지지 않고 싶어 내 맘을 이제 말하고 싶어 벚꽃도 뭐고 다 필요 없어 나는 네 곁에 있고 싶어 딱 붙어서 봄이 지나갈 때까지 다른 사람 다 사라져라 나만 봄
2019	별 보러 갈래?	포크/블루스	maybe it's like a dream I see the stars over me maybe it's like a magic I know you you you're my star saturday night 재미없는 얘기 no beer no cheers 우리 둘만 여기 재미없는 사람끼리 눈이 맞았나 봐 you've heard of my songs 어떤 별을 가장 좋아하냐며 미소를 띠고 내게 말해 별 보러 갈래 listen to our favorite songs 좋아하는 노랠 듣고 웃고 떠들다 보면 we drive away 어느새 멋진 바다 위로 별들이 쏟아져내려 can’t you see the stars they called it milky way 쏟아져 머리 위로 넌 나를 업고 모래사장을 뛰어다녀 yeah 그중 가장 예쁜 저 별을 찾아서 밤이 새도록 뛰어다니고 stars are over me maybe I know the name I see the stars over me maybe you got a planet I know you you got my star everyday night 매일 같은 얘기 no feeling no chilling 우리 둘만 여기 재미없는 사람끼리 눈이 맞았나 봐 you've heard of my songs 어떤 별을 가장 좋아하냐며 미소를 띠고 내게 말해 별 보러 갈래 listen to our favorite songs 좋아하는 노랠 듣고 웃고 떠들다 보면 we drive away 어느새 멋진 바다 위로 별들이 쏟아져내려 can’t you see the stars 모래 위에 누워서 저 별을 다 세보다가 아름다웠던 우리 이 순간을 저 별에 담아서 we fell in love see the star be your star yeah yeah they called it milky way 쏟아져 머리 위로 넌 나를 업고 모래사장을 뛰어다녀 yeah 그중 가장 예쁜 저 별을 찾아서 밤이 새도록 뛰어다니고 stars are over me
2019	Mermaid	포크/블루스	너무 어둡고 캄캄한 내 맘은 네가 알기엔 먼 곳만 같아서 자꾸 난 도망치려 할 때마다 네 그 눈빛이 자꾸만 날 찾아 기억 속에 짓궂게도 네 모습은 습관처럼 고개를 숙이며 어떤 말을 해야 할지 모른 채로 아주 잠시 내 모습을 들여다봐 네가 사라지면 난 없어져 버릴지도 몰라 아주 조용한 바닷속으로 사라질지도 몰라 나는 너를 너무 사랑했었다고 믿겠지만 네가 사라지면 어떤 말도 할 수 없겠지만 아주 조용히 기억 속에 짓궂게도 네 모습은 습관처럼 고개를 숙이며 어떤 말을 해야 할지 모른 채로 아주 잠시 내 모습을 들여다봐 네가 사라지면 난 없어져 버릴지도 몰라 아주 조용한 바닷속으로 사라질지도 몰라 나는 너를 너무 사랑했었다고 믿겠지만 네가 사라지면 어떤 말도 할 수 없겠지만 아주 조용히 아주 조용히 아주 조용히 아주 조용히 겨울이 지나가고 봄이 다가올 때쯤 넌 물어보겠지 어디로 향하냐고 사실 나도 몰라 어디쯤 내가 있는지 그냥 네가 있는 그곳에 여전히 나 머물러 아주 조용히 아주 조용히 아주 조용히 네가 사라지면 난 없어져 버릴지도 몰라 아주 조용한 바닷속으로 사라질지도 몰라 아주 조용히 날 떠나려 하지 마 좋은 노랠 들려줄게 그냥 네 옆에서 널 바라만 볼게 아주 잠시 내가 널 잊어버렸는지 몰라 내 곁에 네 모습이 흐릿해진 줄 모르고 you always be my mermaid
