년도	제목	장르	가사
2011	그대는 철이 없네 (Feat. 김지수)	포크/블루스	마주본 식탁에 성의 없는 젓가락질 시간이 지루하네 느리게 흘러가네 마주본 그대의 성의 없는 반찬을 보면 그대는 철이 없네 우리 둘 변해가네 열두시가 지나가면 또 멀어져가 할 말이 있다면 제대로 말해줘 내 앞에서 철수 그대가 주었던 환상 이젠 모두 사라지네 영희 너에게 걸었던 기대 이젠 모두 멀어지네 멀어져 가는데 내 맘은 어디로 마주본 눈빛에 애정이 보이지 않아 그대는 철이 없네 추억도 변해가네 그대는 몰라 내 맘을 몰라 넋이 나가 밥만 먹어대는 내 맘을 몰라 그댄 정말 몰라 내 맘을 몰라 넋이 나가 밥만 먹어대는 내 맘을 몰라 열두시가 지나가면 또 멀어져가 할 말이 있다면 제대로 말해줘 덤비진 마 철수 그대가 주었던 환상 이젠 모두 사라지네 영희 너에게 걸었던 기대 이젠 모두 멀어지네 멀어져가 오 철없는 그대가 보았던 유리구둔 이제 사라지네 영원할 우리가 걸었던 마법 이젠 모두 없어지네 없어져 가는데 내 맘은 어데로 영원할 우리가 변해온 모습을 보면 사랑은 참 알 수 없네 아직도 고개를 저어 밥맛이 좋지 않아 숟가락을 내려놓네
2011	장난감 병정들	포크/블루스	맞춰진 리듬아래 의미 없는 북장단과 감정 없는 표정 위로 군무를 맞추는 그대 군중의 환호성과 군무의 화려함 뒤 보이는 것만 원하는 네 입맛에 맞춰 춤춘다 장난감 병정들 군무를 맞추네 장난감 병정들 군무를 맞추네 시선을 견뎌봐 군무를 맞추는 그대 가리킨 손가락에 엉뚱한 곳을 보네 갈 곳이 어디였는지 발을 뗄 수가 없네 가만히 휩쓸려가 발을 멈추는 순간 리듬은 사라지고 모두의 얼굴이 널 향하지 시선을 견뎌봐 장난감 병정들 군무를 맞추네 hurry up 장난감 병정들 군무를 맞추네 시선을 견뎌봐 군무를 맞추는 그대 장난감 병정들 군무를 맞추네 춤추는 그대 시선을 견뎌봐 군무를 맞추는 그대 장난감 병정들 군무를 맞추네
2012	내 사랑아	포크/블루스	창밖에 비가 내리면 감춰둔 기억이 내 맘을 적시고 잊은 줄 알았던 사람 오히려 선명히 또 다시 떠올라 내 사랑아 사랑아 그리운 나의 사랑아 목놓아 불러보지만 듣지도 못하는 사랑 내 사랑아 사랑아 보고픈 나의 사랑아 그대 이름만으로도 베인 듯 아픈 사랑아 내 사랑아 창가에 어둠이 오면 숨겨 논 추억이 내 맘을 밝히네 내 사랑아 사랑아 그리운 나의 사랑아 목놓아 불러보지만 듣지도 못하는 사랑 내 사랑아 사랑아 보고픈 나의 사랑아 그대 이름만으로도 베인 듯 아픈 사랑아 내 사랑아 우리 함께 웃음 지었던 순간 우리 함께 눈물 흘렸던 순간 이제 그만 보내지만 내 사랑아 사랑아 고마운 나의 사랑아 내 전부 다 지운대도 가슴에 남겨질 사랑 내 사랑아 사랑아 소중한 나의 사랑아 내 숨이 다 할 때까지 간직할 나의 사랑아 내 사랑아
2016	봄이 좋냐??	포크/블루스	꽃이 언제 피는지 그딴 게 뭐가 중요한데 날씨가 언제 풀리는지 그딴 거 알면 뭐 할 건데 추울 땐 춥다고 붙어있고 더우면 덥다고 니네 진짜 이상해 너의 달콤한 남친은 사실 피씨방을 더 가고 싶어하지 겁나 피곤하대 봄이 그렇게도 좋냐 멍청이들아 벚꽃이 그렇게도 예쁘디 바보들아 결국 꽃잎은 떨어지지 니네도 떨어져라 몽땅 망해라 망해라 아무 문제 없는데 왜 나는 안 생기는 건데 날씨도 완전 풀렸는데 감기는 왜 또 걸리는데 추울 땐 추워서 안생기고 더우면 더워서 인생은 불공평해 너의 완벽한 연애는 아직 웃고 있지만 너도 차일거야 겁나 지독하게 봄이 그렇게도 좋냐 멍청이들아 벚꽃이 그렇게도 예쁘디 바보들아 결국 꽃잎은 떨어지지 니네도 떨어져라 몽땅 손 잡지 마 팔짱 끼지 마 끌어 안지 마 제발 아무것도 하지 좀 마 설레지 마 심쿵하지 마 행복하지 마 내 눈에 띄지 마 봄이 그렇게도 좋냐 멍청이들아 벚꽃이 그렇게도 예쁘디 바보들아 결국 꽃잎은 떨어지지 니네도 떨어져라 몽땅 망해라 망해라 망해라 망해라
2016	심술	포크/블루스	노란 머리 볼에 빨간 홍조 빼빼 묶은 머리 but a girl with bobbed hair 나 신발 꺾어 신고 돌아다녀 Cuz I'm lonely 내가 좋아하는 건 제일 잘하는 건 물어뜯기 꼬집기 깨물기 and 몰래 따라 걷기 with red sunglass Hey Miss short skirt lady 손때 묻은 손수건은 좀 떼줄래 Hey 뭐야 긴 생머리 언니 헐 아이 컨택은 그만 부리고 그 손 떼 헝클어진 머리칼을 흩날리며 네게 건네 조금은 녹아 흘러내린 아이스크림 좀 따가운 시선 받으면 어때 네게 주려고 진득해진 손바닥으로 달려온 나야 너 진짜 귀여워 진짜 잘생겼어 그러니까 여자들이 자꾸 들러붙어 이거 뭐예요 저거 뭐예요 Or you have a girl friend Hey Miss short skirt lady 손때 묻은 손수건은 좀 떼줄래 Hey 뭐야 긴 생머리 언니 헐 아이 컨택은 그만 부리고 그 손 떼 U know what I’m saying 헝클어진 머리칼을 흩날리며 네게 건네 조금은 녹아 흘러내린 아이스크림 좀 따가운 시선 받으면 어때 네게 줄려고 진득해진 손바닥으로 달려 온 나야 Woo Yeah 진짜 얄미운 너 yeah 나는 싫어 네가 볼 꼬집는 거 빨갛게 익은 내 맘 놀리는 것도 싫어 이렇게 심술 부리는 거야
2016	RE-BYE	포크/블루스	Re-e-e bye 미련 없이 손을 흔들어 Re-bye Re-e-e bye 그땐 그때 이땐 이때 Re-bye 익숙해 날 오고 가는 발걸음 헤어지는 인사에 미숙해 보이는 것만큼 부끄러운 게 없는 걸 익숙해 날 보고 가는 시선들 주위 모든 여자 날 야속해 해 But It's OK 부끄러울 게 없는 걸 Oh 눈물로 보낼 필요 없어 자욱한 안개만 남을 뿐 눈물로 흘려보낸 시간이 녹아 남은 건 어디에 Re-e-e bye 미련 없이 손을 흔들어 Re-bye Re-e-e bye 그땐 그때 이땐 이때 Re-bye 뒤돌아서면 그걸로 THE END Re-bye 익숙해 날 오고 가는 발걸음 헤어지는 인사에 미숙해 보이는 것만큼 부끄러운 게 없는 걸 보기 드물어진 정 찾기 힘들어 진정한 partner 놔둬 봐 진정이 안 돼 이미 상한 빈정 많이 나누는 사람이 바보라 불리는 시대를 보시게 두 손에 남은 것 손해만 흥건히 남길 바에 인사는 간단하게 간당간당하게 맘에 문은 깐깐하게 방이 좀 깜깜하네 속을 들키면 Game over 할 수 없이 널 속여 여기까지가 납니다 수상해 냄새가 납니다 Oh 눈물로 보낼 필요 없어 자욱한 안개만 남을 뿐 눈물로 흘려보낸 시간이 녹아 남은 건 어디에 Re-e-e bye 미련 없이 손을 흔들어 Re-bye Re-e-e bye 그땐 그때 이땐 이때 Re-bye 뒤돌아서면 그걸로 THE END Re-bye
2016	새삼스럽게 왜	포크/블루스	Haughty girl 너는 어려워 도도해서 그런가 봐 Unfriendly girl 우린 그냥 인사만 주고받는 사이 근데 그 사이에 사랑이 오갔나 우린 꽤 오래 계속 그냥 알고만 지냈던 사이 딱 그 정도 한 번도 진심 어린 말 없었던 거야 넌 눈치가 없는건지 백 번의 눈짓에도 고개 한 번 끄덕하지 않았는데 Nod for me 새삼스럽게 왜 그러는 거야 안 하던 농담도 하고 오늘 좋은 일 있었나 봐 새삼스럽게 이러지 마세요 내가 내가 오해할까 봐 그래 오해할까 봐 신비한 걸 널 모르겠어 네 눈빛을 보면 기분이 묘해지면서 멍 멍 때리게 돼 신기한 걸 우리 그냥 인사만 주고받았는데 그새 사랑이 오갔나 기대하지 않고 있을게 아주 작게 달라진 너의 행동에도 오만가지 생각이 다 드는 걸 알 수만 있다면 정말 이게 사랑인 걸까 새삼스럽게 왜 그러는거야 안 하던 농담도 하고 오늘 좋은 일 있었나 봐 새삼스럽게 이러지 마세요 내가 내가 오해할까 봐 그래 내가 좋다면 좋다고 아니라면 아니라고 해 사람 헷갈리게 하지 마 이 바보야 좋다면 좋다고 아니라면 아니라고 해 하라고 이 바보야 사귈건지 말건지 툭툭 던지지 말고 표현 좀 하라고 이 내가 오해하는 것 같잖아
2016	사소한 것에서	포크/블루스	잠은 꽤나 잔 것 같은데 또 나오는 하품 저 멀리 나뒹구는 베개와 침대 밑 이불이 내 작품 큰 입 덥석 물리곤 나올 줄 모르는 칫솔과 한 잎만 떨어져도 금방 티나는 앙상한 화초 정말 아름다운 건 내가 선 곳에 있는데 미처 발견 못 하고 지나치는 사람들 다소 식상해 보였던 것 안에 혹은 당연한 일상을 돌아본다면 마치 한 잔의 쉐이크처럼 잊은 듯 아무렇지 않은 척해도 쓰린 사랑의 아픔 아무 이유 없이 반항하곤 했던 사춘기의 질풍 큰 잎이 떨어지면 고개를 내밀던 가을과 한 닢의 동전도 소중했던 어린 시절 나의 친구들과의 추억 정말 아름다운 건 내가 선 곳에 있는데 미처 발견 못 하고 지나치는 사람들 다소 식상해 보였던 것 안에 혹은 당연한 일상을 돌아본다면 마치 한 잔의 쉐이크처럼 shake it shake it oh shake it shake it shake it shake it shake it oh like glass of shake it shake it shake it shake it oh shake it shake it shake it shake it shake it oh like glass of shake it shake it 쉴 틈 없는 달리기에 못 보고 간 꽃들 빈틈없는 지하철에서 옮아 온 고뿔 어쩌면 이런 사소한 것에서 세상이 달라지는지도 몰라
2016	여름밤에 우린	포크/블루스	You will always be my girl I promise you I will be on your side 움직이지 말아줘 눈에 담고 있으니까 작은 표정 하나하나 맘에 담고 싶으니까 꿈을 꾸는듯한 눈부신 오늘 밤 별빛이 가득한 너의 눈을 본 순간 난 알아버렸지 지금 우리 사이 세상에서 가장 특별해 baby 별이 가득한 여름밤에 우린 눈부시게 아름다운 그림 모든 게 다 바래고 지워져도 간직하고 있을게 내 눈을 보면서 너는 어떤 생각해 나는 너를 보면서 또 너를 생각해 넌 알 수 있겠니 지금 우리 사이 세상에서 가장 특별해 baby 별이 가득한 여름밤에 우린 눈부시게 아름다운 그림 모든 게 다 바래고 지워져도 간직하고 있을게 baby 누가 뭐래도 영원토록 우린 이 세상에 하나뿐인 그림 모든 게 다 바래고 지워져도 간직하고 있을게 간직하고 있을게
2016	우주를 줄게	포크/블루스	커피를 너무 많이 마셨나 봐요 심장이 막 두근대고 잠은 잘 수가 없어요 한참 뒤에 별빛이 내리면 난 다시 잠들 순 없겠죠 지나간 새벽을 다 새면 다시 네 곁에 잠들겠죠 너의 품에 잠든 난 마치 천사가 된 것만 같아요 난 그대 품에 별빛을 쏟아 내리고 은하수를 만들어 어디든 날아가게 할거야 Cause I’m a pilot anywhere Cause I’m a pilot anywhere lighting star shooting star 줄게 내 Galaxy Cause I’m a pilot anywhere Cause I’m your pilot 네 곁에 저 별을 따 네게만 줄게 my Galaxy Like a star 내리는 비처럼 반짝이는 널 가지고 싶어 Get ma mind 엄지와 검지만 해도 내 마음을 너무 잘 표현해 붙어 안달 나니까 마냥 떨리기만 한 게 아냐 준비가 되면 쏘아 올린 인공위성처럼 네 주윌 마구 맴돌려 해 더 가까워진다면 네가 가져줄래 이 떨림을 어제는 내가 기분이 참 좋아서 지나간 행성에다가 그대 이름 새겨 놓았죠 한참 뒤에 별빛이 내리면 그 별이 가장 밝게 빛나요 지나간 새벽을 다 새면 다시 네 곁에 잠들겠죠 별빛 아래 잠든 난 마치 온 우주를 가진 것만 같아 난 그대 품에 별빛을 쏟아 내리고 은하수를 만들어 어디든 날아가게 할거야 Cause I’m a pilot anywhere Cause I’m a pilot anywhere Lighting star Shooting star 줄게 내 Galaxy Cause I’m a pilot anywhere Cause I’m your pilot 네 곁에 저 별을 따 네게만 줄게 my Galaxy Cause I’m a pilot anywhere Cause I’m a pilot anywhere Lighting star Shooting star 줄게 내 Galaxy Cause I’m a pilot I’m your pilot Lighting star Shooting star 줄게 my Galaxy la la la la la la la la la la la la
2016	나만 안되는 연애	포크/블루스	왠지 오늘따라 마음이 아픈지 했더니 오늘은 그대가 날 떠나가는 날이래요 왜 항상 나는 이렇게 외로운 사랑을 하는지 도무지 이해가 안가는 이상한 날이에요 왜 그랬는지 묻고 싶죠 날 사랑하긴 했는지 그랬다면 왜 날 안아줬는지 그렇게 예뻐했는지 나만 이런 세상을 살고 있는 것 같아요 바라보기만 하다 포기할 수는 없겠죠 근데도 이렇게 아픈 마음만 가지고 사는 건 도무지 불공평해서 견딜 수가 없어요 Please come back to me 왠지 오늘만은 그렇게 보내기 싫은지 오늘은 그대와 나 마지막인가 봐요 왜 항상 나는 이렇게 아무 말도 못하는지 도무지 이해가 안가는 이상한 날이에요 시작부터 사랑하지 않았다고 내게 말했었다면 그랬다면 나의 마음은 이렇게 굳게 닫혔을까요 나만 이런 세상을 살고 있는 것 같아요 바라보기만 하다 포기할 수는 없겠죠 근데도 이렇게 아픈 마음만 가지고 사는 건 도무지 불공평해서 견딜 수가 없어요 그대는 아무렇지 않겠죠 Please come back to me 내 눈물로 더 이상 붙잡을 수는 없겠죠 Please come back to me 근데도 이렇게 아픈 마음만 가지고 사는 건 도무지 불공평해서 견딜 수가 없어요 Please come back to me Please come back to me 나는 사실 이성적인 게 참 싫어요 그래서 우린 헤어져야만 했으니까 아무렇지 않게 살아가도 매일 밤이 고통스럽겠죠 그대가 정이 많은 사람이었다면 날 안아주진 않았을까요
2016	내 눈에만 보여	포크/블루스	너의 목소리만 넘나 크게 들려 다른 건 아무것도 안 들리고 너의 눈동자만 넘나 크게 보여 아니 내가 정말 미친 걸까 하루 종일 너만 생각하다 보니 머리가 이상해진 것 같아 혹시 내가 너를 좋아하게 돼버린 걸까 아니 내가 그냥 미친 걸까 너는 자꾸 이랬다 저랬다가 나를 흔들고 여기저기 왔다 갔다 헷갈리게 만들고 자꾸만 보여 꿈속에서도 억지로 피하려고 해도 보여 어디든 있어 눈감아 봐도 네 맘은 내 눈에만 보여 내 눈에만 보여 너의 목소리만 넘나 크게 들려 다른 건 아무것도 안 들리고 너의 눈동자만 넘나 크게 보여 아니 내가 정말 미친 걸까 너는 자꾸 있는 듯 없는 듯이 숨으려 하고 나를 피해 이리저리 도망치려 해봐도 자꾸만 보여 꿈속에서도 억지로 피하려고 해도 보여 어디든 있어 눈감아 봐도 네 맘은 내 눈에만 보여 내 눈에만 보여 내 눈에만 보여 내 눈에만 보여
2016	좋다고 말해	포크/블루스	안녕 오늘도 같은 자리 버스 창가에 기대 앉은 네게 인사를 해 Hi 역시 넌 받아 주지를 않네 인기 많고 잘생긴 넌 내게만 그렇게 쌀쌀하게 굴더라 근데 Last Night 기억나 넌 내가 좋다고 했어 그 예쁜 가로등 아래서 넌 내가 좋다고 말했어 다음부턴 모른 척 아닌 척해도 You Have To Know That 확신을 해야 돼 넌 그날 넌 내가 좋다고 했어 Yeah If You Like Me Or Love Me Just Say Yes Yes Yes And Then I'm Your Girlfriend And You're My Boyfriend 어서 내게 좋다고 말해 줘 몰래 오늘도 도서관 맨 앞자리에 기대 앉은 네게 인사를 해 Oh Boy 역시 넌 받아 주지를 않네 인기 많고 잘생긴 넌 내게만 그렇게 쌀쌀하게 굴더라 근데 Last Night 기억나 넌 내가 좋다고 했어 그 예쁜 가로등 아래서 넌 내가 좋다고 말했어 다음부턴 모른 척 아닌 척해도 You Have To Know That 확신을 해야 돼 넌 그날 넌 내가 좋다고 했어 Yeah If You Like Me Or Love Me Just Say Yes Yes Yes And Then I'm Your Girlfriend And You're My Boyfriend 어서 내게 좋다고 말해 줘 Oh 널 참 많이 좋아하는 난데 우린 이어질 수 없는 걸까 내 긴 교복 치마가 부끄러워 초라해 Yeah 네 곁엔 항상 키 크고 예쁜 애들이 넘치는데 Woo If You Like Me If You Love Me Yeah And Then I'm Your Girlfriend And You're My Boyfriend 어서 내게 좋다고 말해 줘 If You Like Me Or Love Me Just Say Yes Yes Yes And Then I'm Your Girlfriend And You're My Boyfriend 어서 내게 좋다고 말해 줘
2017	오랜 날 오랜 밤	포크/블루스	별 하나 있고 너 하나 있는 그곳이 내 오랜 밤이었어 사랑해란 말이 머뭇거리어도 거짓은 없었어 넌 화나 있고 참 조용했던 그곳이 내 오랜 밤이었어 어둠 속에서도 잠 이루지 못해 흐느껴오는 너의 목소리 그대 곁이면 그저 곁에서만 있어도 행복했단 걸 그 사실까지 나쁘게 추억 말아요 오랜 날 오랜 밤 동안 정말 사랑했어요 어쩔 수 없었다는 건 말도 안 될 거라 생각하겠지만 밉게 날 기억하지는 말아줄래요 아직도 잘 모르겠어 당신의 흔적이 지울 수 없이 소중해 잘 자요 안녕 그 말 끝으로 흐른 시간은 오랜 날 같았어 우린 서로에게 깊어져 있었고 난 그게 두려워 넌 가만있고 나도 그러했던 순간은 우리 오랜 날 함께한 시간을 아무런 의미도 없듯이 추억만 하게 하겠죠 그대 곁이면 그저 곁에서만 있어도 보고 싶고 또 행복했어 그건 진심이었소 오랜 날 오랜 밤 동안 정말 사랑했어요 어쩔 수 없었다는 건 말도 안 될 거라 생각하겠지만 밉게 날 기억하지는 말아줄래요 아직도 잘 모르겠어 당신의 흔적이 지울 수 없이 소중해 하늘이 참 뿌옇고 맘을 다잡아야 하죠 이젠 마지막 목소리 마지막 안녕 밉게 날 기억하지는 말아줄래요 아직도 잘 모르겠어 당신의 흔적이 지울 수 없이 소중해
2017	자꾸자꾸	포크/블루스	너 지금 어디서 뭘 할까 니가 참 궁금해 너의 그 말투도 행동도 자꾸 신경 쓰여 나 혼자 꽁꽁 숨겨둔 맘을 숨길 수 없나 봐 친구들이 날 보고 예뻐졌다고 그래 너만 빼고 내 맘 다 아나 봐 우연히 너를 보던 그때부터 시작이었나 봐 내 사랑이 눈을 감아도 자꾸자꾸 생각나 내 눈엔 니가 니가 아른해 살짝 다가와서 꼭 안아줘 상상만으로도 달달 한데 두근거리는 내맘 내맘 들릴까 내 귀엔 너만 너만 들을래 설레는 내 맘을 좀 알아줘 숨길 수 없나 봐 너를 사랑하나 봐 머릿속 가득 찬 생각은 어디로 간 걸까 온통 니 생각만 하다가 하루가 다 가네 얼굴에 웃음이 가득해서 숨길 수 없나 봐 친구들이 날 보고 행복해 보인다 해 너만 오면 내 맘 완벽한데 나처럼 너도 가끔 상상할까 달콤해져 버린 우리 사이 눈을 감아도 자꾸자꾸 생각나 내 눈엔 니가 니가 아른해 살짝 다가와서 꼭 안아줘 상상만으로도 달달 한데 두근거리는 내맘 내맘 들릴까 내 귀엔 너만 너만 들을래 설레는 내 맘을 좀 알아줘 숨길 수 없나 봐 너를 사랑하나 봐 눈을 감아도 자꾸자꾸 생각나 내 눈엔 너만 너만 그려져 살짝 다가와서 꼭 안아준 너를 보면 자꾸 웃음이 나 두근거리는 내맘 내맘 들릴까 달콤한 너만 너만 들을래 설레는 내 맘을 다 알아준 너에게 빠져 버린 날 사랑해줄래 
2017	너란 봄 (Feat. 하림)	포크/블루스	다시 봄이 오려나 봐요 벚꽃도 지겨울 만큼 또다시 외로운 계절을 만나고 부네요 바람은 저 꽃이 너무 예뻐 외롭게 저 커플은 또 마냥 환하게 웃는 거야 너무 서럽게 만드니 왜 아름다운 거야 하필 부러울 게 뭐야 나만 빼고 봄봄봄 다시 봄이 오려나 봐요 벚꽃도 지겨울 만큼 한밤에 깨어나 너무도 싫은데 또 봄이 오네요 너란 봄 봄 봄봄봄 너란 놈 어디 있는 거니 너란 봄 봄 봄봄봄 부네요 봄바람이 알콩달콩한 사랑을 꿈꾸고 살콤달콤한 그대는 오려나 또다시 외로운 하루를 만나면 부네요 바람은 저 꽃이 너무 예뻐 외롭게 저 커플은 또 마냥 환하게 웃는 거야 너무 서럽게 만드니 왜 아름다운 거야 하필 부러울 게 뭐야 나만 빼고 봄봄봄 다시 봄이 오려나 봐요 벚꽃도 지겨울 만큼 한밤에 깨어나 너무도 싫은데 또 봄이 오네요 따뜻한 봄바람이 내 볼을 스치면 얼었던 내 맘에도 봄이 올까요 사랑일까요 다시 봄이 오려나 봐요 벚꽃도 지겨울 만큼 한밤에 깨어나 너무도 싫은데 또 봄이 오네요 너란 봄 봄 봄봄봄 너란 놈 어디 있는 거니 너란 봄 봄 봄봄봄 부네요 봄 바람이
2017	남이 될 수 있을까	포크/블루스	쉴 새 없이 울려 대던 내 전화기는 잠잠해져 가 할 말을 잃은 것 같아 정신없이 쏟아내던 그 모진 말들 주워 담지는 못해 아마 날 떠날 것 같아 난 너를 지울 수 있을까 그저 한 순간에 우린 남이 될 수 있을까 쉽지 않을 걸 알지만 좋았던 날도 많았지만 되돌리기엔 멀리 와 버린 걸까 난 너를 지울 수 있을까 우린 남이 될 수 있을까 눈물조차 흐르지 않아 홧김에 던져 망가진 내 폰 마치 날 보는 것 같아 예전과 달리 잦아진 끝이 없는 듯한 감정싸움에 이제 난 지친 것 같아 난 너를 지울 수 있을까 그저 한 순간에 우린 남이 될 수 있을까 쉽지 않을 걸 알지만 좋았던 날도 많았겠지만 되돌리기엔 멀리 와 버린 걸까 괜찮은 척해도 먹먹해진 기분은 진해져만 가 떨쳐내려 괜히 웃어보아도 숨길 수 없는 걸 이별이 오는 걸 우리의 시간은 멈춰버린걸 난 너를 지울 수 있을까 우린 남이 될 수 있을까 난 너를 지울 수 있을까 그저 한 순간에 우린 남이 될 수 있을까 쉽지 않을 걸 알지만 좋았던 날도 많았지만 되돌리기엔 멀리 와 버린 걸까 난 너를 지울 수 있을까 우린 남이 될 수 있을까 We loved We loved We loved We loved We loved We loved
2017	자꾸자꾸	포크/블루스	너 지금 어디서 뭘 할까 니가 참 궁금해 너의 그 말투도 행동도 자꾸 신경 쓰여 나 혼자 꽁꽁 숨겨둔 맘을 숨길 수 없나 봐 친구들이 날 보고 예뻐졌다고 그래 너만 빼고 내 맘 다 아나 봐 우연히 너를 보던 그때부터 시작이었나 봐 내 사랑이 눈을 감아도 자꾸자꾸 생각나 내 눈엔 니가 니가 아른해 살짝 다가와서 꼭 안아줘 상상만으로도 달달 한데 두근거리는 내맘 내맘 들릴까 내 귀엔 너만 너만 들을래 설레는 내 맘을 좀 알아줘 숨길 수 없나 봐 너를 사랑하나 봐 머릿속 가득 찬 생각은 어디로 간 걸까 온통 니 생각만 하다가 하루가 다 가네 얼굴에 웃음이 가득해서 숨길 수 없나 봐 친구들이 날 보고 행복해 보인다 해 너만 오면 내 맘 완벽한데 나처럼 너도 가끔 상상할까 달콤해져 버린 우리 사이 눈을 감아도 자꾸자꾸 생각나 내 눈엔 니가 니가 아른해 살짝 다가와서 꼭 안아줘 상상만으로도 달달 한데 두근거리는 내맘 내맘 들릴까 내 귀엔 너만 너만 들을래 설레는 내 맘을 좀 알아줘 숨길 수 없나 봐 너를 사랑하나 봐 눈을 감아도 자꾸자꾸 생각나 내 눈엔 너만 너만 그려져 살짝 다가와서 꼭 안아준 너를 보면 자꾸 웃음이 나 두근거리는 내맘 내맘 들릴까 달콤한 너만 너만 들을래 설레는 내 맘을 다 알아준 너에게 빠져 버린 날 사랑해줄래 
