년도	제목	장르	가사
2018	WARNING!	록/메탈	WARNING You gotta stop You gotta stop You gotta stop now You gotta stop You gotta stop You gotta stop now WARNING 위험해 눈빛부터 벌써 아찔해 보이잖아 위험해 손짓부터가 벌써 남다르잖아 모두들 말리지만 안돼 그게 안돼 멈춰서기엔 늦었어 가지 말라지만 안돼 이미 안돼 몸이 내 말을 안 들어 나도 모르게 너에게 푹 빠질 대로 빠져버렸소 이 선을 넘지 마시오란 말이 앞에 뻔히 써있대도 못 참겠어 절대 넘지 말라고 그 누가 뭐라 하든 이미 밟아 버린걸요 이 결말이 뻔하겠지만 널 감당 못하겠지만 But gotta go go go go go go go Gotta go over the line Tonight 그렇게나 하지 마라 하면 또 더 하고 싶더라 사람들이 하지 마라고 말할 땐 이유가 다 있더라 전부 다 말리지만 안돼 그게 안돼 물러서기엔 늦었어 다칠 거라지만 안돼 이미 안돼 몸이 내 말을 안 들어 이 선을 넘지 마시오란 말이 앞에 뻔히 써있대도 못 참겠어 절대 넘지 말라고 그 누가 뭐라 하든 이미 밟아 버린걸요 이 결말이 뻔하겠지만 널 감당 못하겠지만 But gotta go go go go go go go Gotta go over the line Tonight tonight WARNING 나도 모르게 너에게 푹 빠질 대로 빠져버렸소 이 선을 넘지 마시오란 말이 앞에 뻔히 써있대도 못 참겠어 절대 넘지 말라고 그 누가 뭐라 하든 이미 밟아 버린걸요 이 결말이 뻔하겠지만 널 감당 못하겠지만 But gotta go go go go go go go Gotta go over the line Tonight tonight You gotta stop You gotta stop You gotta stop now You gotta stop You gotta stop You gotta stop now You gotta stop You gotta stop You gotta stop now You gotta stop You gotta stop You gotta stop now 
2018	Shoot Me	록/메탈	쉬운 일이 절대 아냐 네 앞에 서는 건 스릴러 한편이야 잘 나가다가도 뭔가 어긋나면 그대로 시작이야 싸늘해져 가는 네 눈빛 무거워지는 분위기 난 그 자리 가만히 앉은 채 숨을 고르고 있어 서로를 향한 말투는 점점 더 날카로워져만 가 그래 날 쏴 Bang bang 너의 Bullet bullet bullet 얼마든지 맞아줄게 원한 게 이거라면 Just shoot me Shoot me 나를 향해 쏴 Bang bang 그게 편해 편해 편해 이젠 너무 익숙해 이걸로 풀린다면 Just shoot me Shoot me 이걸 기대한 건 아냐 너와 원했던 건 로맨스 한편이야 하지만 현실은 툭하면 붉어져 한편의 드라마야 너의 대사 속 이젠 끝이야 진심이 아니길 빌어 그저 불안한 맘에 뱉은 거라고 믿고 싶어 서로를 향한 말투는 점점 더 날카로워져만 가 그래 날 쏴 Bang bang 너의 Bullet bullet bullet 얼마든지 맞아줄게 원한 게 이거라면 Just shoot me Shoot me 나를 향해 쏴 Bang bang 그게 편해 편해 편해 이젠 너무 익숙해 이걸로 풀린다면 Just shoot me Shoot me I’m okay So if you wanna hurt me Baby just hurt me I’m okay So if you wanna hurt me Baby just hurt me 가슴에 박히는 너의 한발 한발이 사실은 너무 아파 It hurts so bad so bad 그래 날 쏴 Bang bang 너의 Bullet bullet bullet 얼마든지 맞아줄게 원한 게 이거라면 Just shoot me Shoot me 나를 향해 쏴 Bang bang 그게 편해 편해 편해 이젠 너무 익숙해 이걸로 풀린다면 Just shoot me Shoot me 
2018	어쩌다 보니	록/메탈	일부러 힘들어도 참았어 네가 너무 보고 싶을 때 너의 집 앞으로 발길이 향할 때 Oh no 일부러 치다가도 지웠어 이미 외워버린 네 번호 아무리 지워도 잊혀지지 않아서 Oh no 그렇게 시간은 흘렀고 어느새 나도 모르게 너에게 벗어나 혼자 서게 되었어 어쩌다 보니 난 널 조금씩 잊어가고 있던 거야 멈추지 않을 듯한 아픔 속에서 그게 어쩌다 보니 난 널 서서히 버려 내고 있던 거야 이렇게 살다 보면 지워지겠지 어찌하다 보면 다 일부러 정신 없이 살았어 아무렇지 않은 척해도 혼자 있을 때면 너무 생각나서 Oh no 일부러 괜찮은 척 웃었어 웃다 보면 괜찮을까 봐 그러다 보면 정말 웃을 수 있을까 봐 Oh no 그렇게 시간은 흘렀고 어느새 나도 모르게 너에게 벗어나 혼자 서게 되었어 어쩌다 보니 난 널 조금씩 잊어가고 있던 거야 멈추지 않을 듯한 아픔 속에서 그게 어쩌다 보니 난 널 서서히 버려 내고 있던 거야 이렇게 살다 보면 지워지겠지 어찌하다 보면 결국엔 상처가 아물어 버릴지 몰라 전혀 몰라 다 괜찮아질 거야 I don’t need you 어쩌다 보니 난 널 조금씩 잊어 가고 있던 거야 멈추지 않을 듯한 아픔 속에서 그게 어쩌다 보니 난 널 서서히 버려 내고 있던 거야 이렇게 살다 보면 지워지겠지 어찌하다 보면 다 
2018	Feeling Good	록/메탈	음 오늘 날씨도 좋은데 넌 뭐해 지금 나가면 딱일 텐데 너도 함께하지 않을래 Hey just come out 어디 가든 I don't care 그냥 거기 너만 있으면 되는 거야 무엇을 하든 I don't care 그냥 철없이 밤을 느끼러 한번뿐인 오늘을 즐기러 Go We feeling good yeah We feeling good tonight 기분 좋은 밤이야 뭐든 우리 맘이야 We feeling good yeah We feeling good tonight 느낌 있는 밤이야 우리 맘대로 놀 거라고 달려보자고 말릴 생각 말라고 아마 밤새도록 미칠 거야 느낌 왔으니까 꾸미지는 마 편하게 나와 벌써 어두워지기 시작했잖아 늦기만 해봐 뭐라 할 거야 먼저 가버린다 어디 가든 I don't care 그냥 거기 너만 있으면 되는 거야 무엇을 하든 I don't care 그냥 철없이 밤을 느끼러 한번뿐인 오늘을 즐기러 Go We feeling good yeah We feeling good tonight 기분 좋은 밤이야 뭐든 우리 맘이야 We feeling good yeah We feeling good tonight 느낌 있는 밤이야 우리 맘대로 놀 거라고 달려보자고 말릴 생각 말라고 아마 밤새도록 미칠 거야 느낌 왔으니까 We got the feeling We we got the feeling Tonight We got the feeling We we got the feeling 아름다운 밤을 느끼러 한번뿐인 인생을 즐기러 Go We feeling good yeah We feeling good tonight 기분 좋은 밤이야 뭐든 우리 맘이야 We feeling good yeah We feeling good tonight 느낌 있는 밤이야 우리 맘대로 놀 거라고 달려보자고 말릴 생각 말라고 아마 밤새도록 미칠 거야 느낌 왔으니까 
2018	혼잣말	록/메탈	혼잣말이 늘어가 네가 떠난 뒤로 이젠 어색하지도 않아 어쩌나 아까는 식탁 위에 있던 죄 없는 과자봉지만 구기고 던지면서 화내고 있더라 어쩌나 뭐하냐 아 몰라 괜찮냐 괜찮겠냐 널 대신할 머릿속의 목소리 나가자 아 싫어 일어나 싫다고 무기력해 뭣도 하기 싫어 나도 알아 안다고 뭐라도 해야지 근데 참 엉덩이가 안 떨어지는걸 나더러 어떡하라고 Just talking to 나 말할 사람이 없어서 누가 봐도 널 보낸 건 나니까 I'm just talking to 나 탓하지도 못하겠어 나를 혼자가 되게 만든 건 나였으니까 야 그때 왜 그랬냐 이 자식아 너도 문제다 상태는 심각 이 정도면 거의 뭐 던짐각 나도 알어 아아아 나도 알어 야 자존심이 그리 중요했냐 뭣이 중요한지도 몰랐던 거냐 나도 안다니까 아는데 왜 그랬냐 인간은 같은 실수를 반복하니까 Just talking to 나 말할 사람이 없어서 누가 봐도 널 보낸 건 나니까 I'm just talking to 나 탓하지도 못하겠어 나를 혼자가 되게 만든 건 나였으니까 사실 요즘 다 귀찮아 밥 먹기도 특히 치우는 게 귀찮아 나도 모르게 습관이 됐나 봐 2인분을 차리는 거 마마말이야 사실 요즘 잠도 안 와 더워서 더욱 그런가 봐 항상 이불 뺏던 네가 옆에 없으니깐 더워 죽겠다 잠이 안 와 미치겠다 Just talking to 나 말할 사람이 없어서 누가 봐도 널 보낸 건 나니까 I'm just talking to 나 탓하지도 못하겠어 나를 혼자가 되게 만든 건 나였으니까 
2018	원하니까	록/메탈	Someday 먹구름은 지나가겠지 Someday 우리도 해맑게 웃는 날이 또 돌아올 거라는 희망을 가지고 있어 따스하게 비추던 햇살을 맞으며 함께 걷던 그 거린 이제 그늘지고 어두워져 그때처럼 아름다워 보이지 않아 오늘따라 하늘은 왜 이리 흐린 건지 구름 사이 내리는 한 줄기의 빛처럼 희미하게나마 나를 웃게 해 줄 네 손길이 필요해 너와 내 사이 화창했던 그 날들은 이미 지나 버렸지만 포기해 버리기엔 아직도 난 널 원하나 봐 Someday 날은 다시 맑아지겠지 Someday 우리에게 드리워진 어둠도 사라질 거라는 희망을 가지고 있어 오늘따라 눈앞이 왜 이리 흐린 건지 구름 사이 내리는 한 줄기의 빛처럼 희미하게나마 나를 웃게 해 줄 네 손길이 필요해 너와 내 사이 화창했던 그 날들은 이미 지나 버렸지만 포기해 버리기엔 아직도 난 널 우리도 한땐 나란히 서서 걷던 날들이 있었잖아 그토록 아름답던 모습들이 아직까지 선명한데 So goodbye 원하지 않는 이별이라도 어느 한 사람이 등을 돌린 순간 끝은 정해진 거야 너와 내 사이 이제는 돌릴 수 없겠기에 난 이 자리에서 머물게 될 거야 아직도 난 널 원하니까 
2018	Let Me Show You	록/메탈	When I look back the road we've taken I never knew we'd be like this Young wild and free didn't know Now our life is like a tornado Emotions like a volcano Thought I was there not even close Oh 돌아간다면 또 사랑에 빠질까 흔한 영화처럼 네게 또 반해버렸다면 믿을 수 없겠지 So let me show you 뻔한 소설처럼 우리 다시 사랑하게되면 행복할 수 있을까 So let me show you So let me show you So let me show you So let me show you 너로 인한 뜨거움이 식어서 한숨이 되고 그제서야 돌아봐 내가 너와 있을땐 그냥 지나친 너의 외로움 네 눈물 이제서야 돌아와 내게 Yeah Oh 돌이킨다면 또 널 아프게 할까 흔한 영화처럼 네게 또 반해버렸다면 믿을 수 없겠지 So let me show you 뻔한 소설처럼 우리 다시 사랑하게되면 행복할 수 있을까 So let me show you Know what it feels like 네 앞에 선 나 Know what it feels like Feels like feels like 흔한 영화처럼 네게 또 반해버렸다면 믿을 수 없겠지 So let me show you 뻔한 소설처럼 우리 다시 사랑하게되면 행복할 수 있을까 So let me show you So let me show you So let me show you So let me show you 
2018	Beautiful Feeling	록/메탈	널 바라보고만 있어도 나도 모르게 미소를 짓고 있는 나를 보면 신기해 하루가 지나갈 수록 널 향한 나의 맘은 더 깊어지고 있어 지금 이 노래가 또 다른 사랑노래 같을 수 있어 Yeah I know 그래도 난 부르고 싶어 지금 이 느낌을 So baby 들어줘 너를 위해 부를게 너와 같은 하늘아래에 숨쉬는 매 순간이 난 좋아 사랑이란 단어론 충분하지가 않아 이 아름다운 느낌 It's beautiful It's beautiful This beautiful feeling 이 아름다운 느낌 It's beautiful It's beautiful 말로 다 할 수 없어 이 아름다운 느낌 지금 이 노래가 또 다른 사랑노래 같을 수 있어 Yeah I know 그래도 난 부르고 싶어 지금 이 느낌을 So baby 들어줘 너를 위해 부를게 너와 같은 하늘아래에 숨쉬는 매 순간이 난 좋아 사랑이란 단어론 충분하지가 않아 이 아름다운 느낌 온 몸에 전율이 흘러 너무 기쁘다 못해 눈물이 흘러 ye Some people say love 하지만 난 그것보다 더한 뭔가 있는 것 같아 ye 안다면 알려줘 없다면 지어줘 To this beautiful feeling 이 아름다운 느낌 너와 같은 하늘아래에 숨쉬는 매 순간이 좋아 사랑이란 단어론 충분하지가 않아 이 아름다운 느낌 It's beautiful It's beautiful This beautiful feeling 이 아름다운 느낌 It's beautiful It's beautiful 말로 다 할 수 없어 이 아름다운 느낌 
2018	Let Me Show You	록/메탈	When I look back the road we've taken I never knew we'd be like this Young wild and free didn't know Now our life is like a tornado Emotions like a volcano Thought I was there not even close Oh 돌아간다면 또 사랑에 빠질까 흔한 영화처럼 네게 또 반해버렸다면 믿을 수 없겠지 So let me show you 뻔한 소설처럼 우리 다시 사랑하게되면 행복할 수 있을까 So let me show you So let me show you So let me show you So let me show you 너로 인한 뜨거움이 식어서 한숨이 되고 그제서야 돌아봐 내가 너와 있을땐 그냥 지나친 너의 외로움 네 눈물 이제서야 돌아와 내게 Yeah Oh 돌이킨다면 또 널 아프게 할까 흔한 영화처럼 네게 또 반해버렸다면 믿을 수 없겠지 So let me show you 뻔한 소설처럼 우리 다시 사랑하게되면 행복할 수 있을까 So let me show you Know what it feels like 네 앞에 선 나 Know what it feels like Feels like feels like 흔한 영화처럼 네게 또 반해버렸다면 믿을 수 없겠지 So let me show you 뻔한 소설처럼 우리 다시 사랑하게되면 행복할 수 있을까 So let me show you So let me show you So let me show you So let me show you 
2018	Chocolate	록/메탈	상상을 하곤 해 너와 입을 맞출 때 그게 어떤 느낌일지 궁금해 이럼 안된다는 걸 뻔히 알고 있는데 안되니까 난 더 생각하게 돼 너에게 내 마음이 들킬까 봐 겁이 나서 다가가다 물러났어 하지만 나 이러다가 미쳐버릴 것 같아서 말인데 Chocolate 그만해야 해 난 알면서도 생각을 멈출 수 없네 맘이 가고 또 맘이 가네 생각할 수록 넌 너무 달콤하기에 Chocolate 보다 달콤할 걸 잘 아니까 나도 몰래 가는 시선이 네 입술에 멈추지 뭐니 맛본 적 없는 맛을 왜 난 알 것만 같니 탐하지 말자 결심할 수록 욕심이 내 맘에 가득히 차네 이러는 내 모습에 나도 참 놀라네 내 맘이 말을 듣지를 않네 내 안에 또 다른 내가 있나 봐 내 안에 두 마음이 다투니까 하지만 나 이러다가 후회할 것만 같아서 말인데 Chocolate 그만해야 해 난 알면서도 생각을 멈출 수 없네 맘이 가고 또 맘이 가네 생각할 수록 넌 너무 달콤하기에 손이 스칠 때 그 짜릿함마저 느끼면 안되지 맞죠 널 볼 때마다 내 머릿속에 그리는 그림은 So sweet like chocolate 그만해야 해 난 알면서도 생각을 멈출 수 없네 맘이 가고 또 맘이 가네 생각할 수록 넌 너무 달콤하기에 Chocolate 보다 달콤할 걸 잘 아니까 나도 몰래 가는 시선이 네 입술에 멈추지 뭐니 맛본 적 없는 맛을 왜 난 알 것만 같니 
2018	아픈 길	록/메탈	하루에 몇 번씩 눈물이 차오를까 세어보려고 해도 난 못해 사실은 항상 참고 있는 거라서 요즘 난 어때 네가 봤을 때 괜찮아 보이는지 궁금해 요즘 내가 어떤 표정을 짓고 있는지 나는 모르거든 만약에 내가 너라면 아무 말없이 날 안아줄 거야 만약에 네가 나라면 그 품에 안겨 흐느끼고 있겠지 너나 나나 알기는 알았잖아 쉽지만은 않은 길이란 걸 말야 너나 나나 모르진 않았잖아 이 길에는 꽃이 그리 많이 피지 않는 걸 가끔씩 보이는 꽃이 얼마나 소중한지 몰라 너무 예쁘고 좋아서 여기 남아있는 거겠지 요즘 넌 어때 내가 봤을 땐 나랑 아마 비슷할 것 같애 요즘 네가 어떤 표정을 짓고 있어도 슬퍼 보이거든 만약에 내가 너라면 아무 말없이 날 안아줄 거야 만약에 네가 나라면 그 품에 안겨 흐느끼고 있겠지 너나 나나 알기는 알았잖아 쉽지만은 않은 길이란 걸 말야 너나 나나 모르진 않았잖아 이 길에는 꽃이 그리 많이 피지 않는 걸 가끔씩 보이는 꽃이 얼마나 소중한지 몰라 너무 예쁘고 좋아서 여기 남아있는 거겠지 
2018	행복했던 날들이었다	록/메탈	저녁 노을을 바라보며 널 만나 다행이라고 하던 날이 벌써 꽤나 오래 전 이야기야 이제는 노을은 밤의 시작일 뿐이야 모든 게 아름다웠어 우울한 날들은 없었어 지금 돌이켜보면 우습기도 하지만 후회는 남기지 않았어 사랑했으니까 뭐 됐어 첫째 날부터 마지막 날까지 아 행복했던 날들이었다 꿈만 같았었지 이제 더는 없겠지만 지난 날로 남겨야지 말하다 생기는 정적은 전엔 아무렇지 않았는데 이젠 달라 너무도 길게 느껴지고 가슴이 쓰리고 답답해서 힘들어 매 순간이 아까웠어 가는 시간이 참 미웠어 지금 돌이켜 보면 바보 같긴 하지만 후회는 남기지 않았어 사랑했으니까 뭐 됐어 첫째 날부터 마지막 날까지 아 행복했던 날들이었다 꿈만 같았었지 이제 더는 없겠지만 지난 날로 남겨야지 아주 가끔은 그리워할 거야 널 사실 가끔은 아니고 자주겠지 아주 가끔은 눈물이 흐를 거야 그 때도 괜찮다고 되뇌일 거야 아 행복했던 날들이었다 꿈만 같았었지 이제 더는 없겠지만 지난 날로 남겨야지 
2018	두통	록/메탈	Oh please 나를 좀 봐줘 앞에 있잖아 Oh please 아무 말이라도 뭐라고 해줘 너는 나를 지웠어 난 이제 없어 내게서도 점점 사라져 내가 보는 너의 눈엔 내가 있지 않아 폰 화면만 있잖아 내가 보기에 넌 날 사랑하지 않아 예전 같지가 않아 Babe Please don’t go 아프게 해도 괜찮으니까 차라리 머릿속의 두통이 돼 줄래 적어도 널 느낄 수는 있게 진짜 괜찮으니까 차라리 화내고 욕이라도 해줄래 너를 느낄 수 있게 일단 말수가 줄었어 문자 글자 수도 마찬가지 표정도 사라졌잖아 얼굴에 기쁨도 슬픔도 보이지가 않아 Babe Be my headache 아프게 해도 괜찮으니까 차라리 머릿속의 두통이 돼 줄래 적어도 널 느낄 수는 있게 진짜 괜찮으니까 차라리 화내고 욕이라도 해줄래 너를 느낄 수 있게 Baby I am here 왜 나를 보질 못해 Baby am I weird 왜 자꾸 날 꺼려해 너의 숨소리에 한마디라도 얹어줘 고통이라도 지워줘 고통이라도 안겨줘 아프게 해도 괜찮으니까 차라리 머릿속의 두통이 돼 줄래 적어도 널 느낄 수는 있게 진짜 괜찮으니까 차라리 화내고 욕이라도 해줄래 너를 느낄 수 있게 
2018	121U	록/메탈	자꾸 취하게 하지 마 너한테 네 미소에 점점 멈추기 힘들어 갈 수록 중독돼 Uh oh 네 눈빛 손짓 하나하나 사람 홀리게 하는 게 있어 It’s dangerous 전에도 봤어 너 같은 애 꽤 만나봤는데 상처 주더라고 Dangerous I don’t want to want you 이러면 안 되는데 머리론 아는데 Dangerous I don’t want to love you 시작해 버린 순간 못 헤어나올 걸 아니까 다가오지 마 제발 멈춰 줄래 거기 멈춰 줄래 빠지기 싫어 싫어 싫어 나를 잡지 마 제발 놓아 줄래 날 떠나가 줄래 그냥 날 버려 버려 버려 버려 Dangerous 딱히 내가 아니어도 문제될 건 없잖아 단지 너의 외로움을 달래긴 싫거든 진지하진 않잖아 가벼운 간보기잖아 너의 눈웃음은 이 자리에 있는 만인의 거잖아 네 눈빛 손짓 하나하나 사람 홀리게 하는 게 있어 It’s dangerous 전에도 봤어 너 같은 애 매달려 봤는데 상처 받더라고 Dangerous I don’t want to want you 이러면 안되는데 머리론 아는데 Dangerous I don’t want to love you 시작해 버린 순간 못 헤어나올 걸 아니까 다가오지 마 제발 멈춰 줄래 거기 멈춰 줄래 빠지기 싫어 싫어 싫어 나를 잡지 마 제발 놓아 줄래 날 떠나가 줄래 그냥 날 버려 버려 버려 버려 Dangerous You don’t love me So don’t want me You don’t need me Just leave me 못 헤어나올 걸 아니까 It’s dangerous I don’t want to want you 이러면 안되는데 머리론 아는데 Dangerous I don’t want to love you 시작해 버린 순간 못 헤어나올 걸 아니까 다가오지 마 제발 멈춰 줄래 거기 멈춰 줄래 빠지기 싫어 싫어 싫어 나를 잡지 마 제발 놓아 줄래 날 떠나가 줄래 그냥 날 버려 버려 버려 버려 
2018	완전 멋지잖아	록/메탈	알람 소리가 오늘은 딱히 싫지가 않아 못 잤는데도 약간 뿌예진 거울 속의 나를 보면서 얌마 느낌 좋다 임마 I will make you just love me 못 다물지 몰라 너의 예쁜 Lips 걸음걸이부터가 달라 느낌 있게 너를 향해 다가가는 중 완전 멋지잖아 머리부터 발끝까지 다 완벽한 채로 네 앞에 서서 저기 How you doin' babayyyyyyy 다들 수군대 대체 누군데 저리 멋있대 쟤 봐 쟤 봐 아주 이놈의 인기를 어떻게 해 건들건들거리면서 걸어 세상이 내 발 아래에 음악 없이도 리듬이 몸에 베어 있어 창문에 비친 나를 보고 Wussup 입술 살짝 내민 채로 멋있는 표정 얌마 잘 생겼다 임마 I will make you just love me 못 다물지 몰라 너의 예쁜 Lips 걸음걸이부터가 달라 느낌 있게 너를 향해 다가가는 중 완전 멋지잖아 머리부터 발끝까지 다 완벽한 채로 네 앞에 서서 저기 How you doin' babayyyyyyy 다들 수군대 대체 누군데 저리 멋있대 쟤 봐 쟤 봐 아주 이놈의 인기를 어떻게 해 다 쳐다보네 아주 피곤해 거의 뭐 연예인 I know I know 아주 이놈의 매력을 어떻게 해 어 걸음걸이부터가 달라 느낌 있게 너를 향해 다가가는 중 완전 멋지잖아 머리부터 발끝까지 다 완벽한 채로 네 앞에 서서 저기 How you doin' babayyyyyyy 착각에 빠졌다 하지 마 나에게는 내 모습이 다 정답이야 완전 멋지잖아 놀란 눈으로 날 보지 마 네가 알고 있던 내가 아냐 저기 How you doin' babyyyy 
2018	마라톤	록/메탈	시작은 위대했고 넌 자신이 있었어 이렇게나 힘이 들 줄 너는 몰랐어 어느 누구도 몰랐어 Mhm 어느새 다 지쳐 있었고 언제든 주저앉으려 하는 널 보며 안타까웠어 No no 하지만 지금 Can't stop 멈춰버리면 Can't stop 너무나 뒤쳐질 거라는 생각에 일어나지 못할 거라는 생각에 바보같이 넌 Can't stop Oh 미련하게도 Won't stop 네가 왜 달리는지도 모르는 채 여기까지 혼자서 외로이 왔어 Don't you run run run 많이 힘들잖아 이젠 걸어도 괜찮아 괜찮아 잠깐 쉬어도 좋아 쉬엄쉬엄도 좋아 무리하지 않아도 돼 Don't you run run run 많이 힘들잖아 이젠 걸어가도 괜찮아 지금 너의 곁엔 내가 있어 함께 걸어가는 내가 있어 So it's okay yeah 천천히 가도 It's okay yeah 사실은 나도 너랑 다를 거 하나 없어 앞지른 사람이 날 비웃고 있을까 봐 나도 멈추지 못했어 yeah 바보같이 난 Can't stop Oh 미련하게도 Won't stop 내가 왜 달리는지도 모르는 채 여기까지 나도 혼자서 왔어 Don't you run run run 많이 힘들잖아 이젠 걸어도 괜찮아 괜찮아 잠깐 쉬어도 좋아 쉬엄쉬엄도 좋아 무리하지 않아도 돼 Don't you run run run 많이 힘들잖아 이젠 걸어가도 괜찮아 지금 너의 곁엔 내가 있어 함께 걸어가는 내가 있어 So it's okay yeah 천천히 가도 It's okay yeah It's okay to be slow It's okay to be slow It's okay to be slow It's okay to be slow It's okay to be slow It's okay to be slow It's okay to be slow It's okay to be slow Don't you run run run 많이 힘들잖아 이젠 걸어도 괜찮아 괜찮아 잠깐 쉬어도 좋아 쉬엄쉬엄도 좋아 무리하지 않아도 돼 Don't you run run run 많이 힘들잖아 이젠 걸어가도 괜찮아 지금 너의 곁엔 내가 있어 함께 걸어가는 내가 있어 So it's okay yeah 천천히 가도 It's okay yeah 
2018	Beautiful Feeling	록/메탈	널 바라보고만 있어도 나도 모르게 미소를 짓고 있는 나를 보면 신기해 하루가 지나갈 수록 널 향한 나의 맘은 더 깊어지고 있어 지금 이 노래가 또 다른 사랑노래 같을 수 있어 Yeah I know 그래도 난 부르고 싶어 지금 이 느낌을 So baby 들어줘 너를 위해 부를게 너와 같은 하늘아래에 숨쉬는 매 순간이 난 좋아 사랑이란 단어론 충분하지가 않아 이 아름다운 느낌 It's beautiful It's beautiful This beautiful feeling 이 아름다운 느낌 It's beautiful It's beautiful 말로 다 할 수 없어 이 아름다운 느낌 지금 이 노래가 또 다른 사랑노래 같을 수 있어 Yeah I know 그래도 난 부르고 싶어 지금 이 느낌을 So baby 들어줘 너를 위해 부를게 너와 같은 하늘아래에 숨쉬는 매 순간이 난 좋아 사랑이란 단어론 충분하지가 않아 이 아름다운 느낌 온 몸에 전율이 흘러 너무 기쁘다 못해 눈물이 흘러 ye Some people say love 하지만 난 그것보다 더한 뭔가 있는 것 같아 ye 안다면 알려줘 없다면 지어줘 To this beautiful feeling 이 아름다운 느낌 너와 같은 하늘아래에 숨쉬는 매 순간이 좋아 사랑이란 단어론 충분하지가 않아 이 아름다운 느낌 It's beautiful It's beautiful This beautiful feeling 이 아름다운 느낌 It's beautiful It's beautiful 말로 다 할 수 없어 이 아름다운 느낌 
