년도	제목	장르	가사
2017	사랑이 잘 (With 오혁)	R&B/Soul	미리 말할게 사과는 안 해 아무 말 없이 너 후회 안 해 다 관심 없잖아 친구야 뭐야 Oh you know what to do 피곤해 그만 오늘은 놔 줘 더 이상 반복하긴 싫어 또 다 내가 나빠 아마 그래 난 널 미워하나 봐 사랑이 잘 안 돼 떠올려 봐도 피부를 비비고 안아봐도 입술을 맞춰도 참 생각대로 되지 않아 웃긴 것 같아 되돌려보려고 서로 모른 척해도 이제 와 우리가 어떻게 다시 사랑 같은 걸 하겠어 다섯 번째 미안하단 말이 이젠 너에게는 지겨운 건지 마지막일 거란 예감이 들어 Oh you know what to do 이건 내가 오늘 하루 종일 그린 저녁은 분명 아니야 널 보면 자꾸 네 안에 내가 보여서 이젠 내가 싫어 사랑이 잘 안 돼 떠올려 봐도 피부를 비비고 안아봐도 입술을 맞춰도 참 생각대로 되지 않아 웃긴 것 같아 되돌려보려고 계속 모른 척해도 이제 와 우리가 어떻게 다시 사랑 같은 걸 하겠어 어디야 넌 어디야 집이야 난 택시야 집에 거의 다 와가니 Oh 미안해 뭐 어떤 게 그냥 다 들어가 나 지갑 거기 두고 왔어 Oh 있잖아 아니야 말해 봐 이제 더 사랑하지 않는 것 같아 아 사랑이 잘 안 돼 떠올려 봐도 피부를 비비고 안아봐도 입술을 맞춰도 참 생각대로 되지 않아 웃긴 것 같아 되돌려보려고 서로 모른 척해도 이제 와 우리가 어떻게 다시 사랑 같은 걸 하겠어
2017	She`s a Baby	R&B/Soul	믿을 수가 없어 난생 처음인 걸 이만큼 쏟아부었던 적 퉁명스러운 말투 숨겨놓은 그 마음을 입맞춤으로 눈치챘어 특별해 좀 인정해 온갖 참견이 너만 지목해 It's okay 내가 이제 하루 종일 돌봐줄게 She's a baby 알고 보면 애기 혼자 두면 큰일 나요 All day 때찌때찌 털끝 하나 건드렸담 봐 Let her sleep well yeah 잘 들어 손 안 쓰고 간지럼 태울게 좋아해란 말은 그만 관둘래 얼마 못 가서 넌 날 엄청나게 사랑하게 될 거야 이렇게 행복할 땐 뒤도는 거 아니야 ah ah How ya feel 기분 어때 고개 까딱까딱해줘 She's a baby 알고 보면 애기 혼자 두면 큰일 나요 All day 때찌때찌 털끝 하나 건드렸담 봐 Let her sleep well yeah 내 검지를 움켜진 작은 손엔 복숭아 향이 나 얼마나 멋져져야 그 눈동자에 나만 담길까 남김없이 다 퍼다 줄래 개털 돼도 뭐랬어 중간 없대도 Not enough 심장에 무리 갈 만큼 해야지 가끔 힘들면 그 시간 나한테 맡겨 깨끗이 해결 짓고 올게 그땐 말없이 안겨 혼란만 부추겼던 등장인물이었지만 지나보면 못 잊을 줄거리야 네 얘기야 She’s a baby 알고 보면 애기 혼자 두지 않을 거야 절대 Happy happy 네 남자친구 부럽다 정말
2017	팔레트 (Feat. G-DRAGON)	R&B/Soul	팔레트   이상하게도 요즘엔 그냥 쉬운 게 좋아 하긴 그래도 여전히 코린 음악은 좋더라 Hot Pink 보다 진한 보라색을 더 좋아해 또 뭐더라 단추 있는 Pajamas Lipstick 좀 짓궂은 장난들 I like it I'm twenty five 날 좋아하는 거 알아 I got this I'm truly fine 이제 조금 알 것 같아 날 긴 머리보다 반듯이 자른 단발이 좋아 하긴 그래도 좋은 날 부를 땐 참 예뻤더라 오 왜 그럴까 조금 촌스러운 걸 좋아해 그림보다 빼곡히 채운 Palette 일기 잠들었던 시간들 I like it I'm twenty five 날 미워하는 거 알아 I got this I'm truly fine 이제 조금 알 것 같아 날 어려서 모든 게 어려워 잔소리에 매 서러워 꾸중만 듣던 철부지 애 겨우 스무고개 넘어 기쁨도 잠시 어머 아프니까 웬 청춘이래 지은아 오빠는 말이야 지금 막 서른인데 나는 절대로 아니야 근데 막 어른이 돼 아직도 한참 멀었는데 너보다 다섯 살 밖에 안 먹었는데 스물 위 서른 아래 고맘때 Right there 애도 어른도 아닌 나이 때 그저 나일 때 가장 찬란하게 빛이 나 어둠이 드리워질 때도 겁내지 마 너무 아름다워서 꽃잎 활짝 펴서 언제나 사랑 받는 아이 YOU Palette 일기 잠들었던 시간들 I like it I'm twenty five 날 좋아하는 거 알아 I got this I'm truly fine 이제 조금 알 것 같아 날 아직 할 말이 많아 I like it I'm twenty five 날 미워하는 거 알아 I got this I've truly found 이제 조금 알 것 같아 날
2017	Lonely (Feat. 태연)	R&B/Soul	미안해 내 탓이야 고마워 덕분이야 툭하면 내뱉던 네 그 말버릇 너도 힘든 걸 난 다 아는데 아마 넌 내가 바본 줄 아나 봐 우는 얼굴로 나 힘들다 하면 정말 나아질까 그럼 누가 힘들까 아프다 징징대면 모두 다 괜찮아지는데 아마 너와 난 착각 속에 서로를 가둬둔 지 몰라 아냐 너는 날 이해 못 해 걱정 어린 네 눈을 볼 때면 Baby I’m so Lonely so Lonely 나는 혼자 있는 것만 같아요 지친 널 볼 때면 내가 너에게 혹시 짐이 될까 많이 버거울까 Baby I’m so Lonely so Lonely 나도 혼자 있는 것만 같아요 그래도 너에게 티 내기 싫어 나는 혼자 참는 게 더 익숙해 날 이해해줘 우린 함께 있지만 같이 걷질 않잖아 외로움과 괴로움 기억 하나 차인 건데 넌 왜 자꾸 다르게만 적으려 하는 건지 Baby I’m so Lonely so Lonely 나는 혼자 있는 것만 같아요 그래도 너에게 티 내기 싫어 나는 혼자 참는 게 더 익숙해 날 이해해줘 날 내버려 둬 Baby I’m so Lonely so Lonely 나는 혼자 있는 것만 같아요 Baby I’m so Lonely so Lonely 나도 혼자 있는 것만 같아요 그래도 너에게 숨기기 싫어 나는 혼자 참는 게 더 익숙해 날 이해해줘
2017	오늘 취하면 (Feat. 창모) (Prod. SUGA)	R&B/Soul	아직 잊지 못하고 아주 달콤히 맴돌아 나 꿈인 줄 모르고 star 헤매이고 있어 그냥 어지러운 가봐요 잠이 든 그댄 아무 말도 말아요 이미 익숙해진 우리 미로 사이 참을 수 없어 Have a feel so sweet 어색했던 우리 첫 와인처럼 쓰고 아프지만 두 눈에 가득 담아 흐르는 대로 널 보내줄게 나 너에게 취해 난 이 밤에 취해 니가 모질게 했던 그 기억 속에 그 추억에 헤매 널 찾고 있어 그냥 잊을래 너의 맘도 알고 싶어 boy 그냥 잊어줘 Baby Please don't go 나 바빠 Bay 아니야 그만 잡아 Phone 우리 얘기 다 끝났어 난 차가운 남자라고 누가 취하면 그런 거 못해 잡다 놓다가 새 Phone에 지문 묻히기 누가 못하냐고 알아 난 나이 24 이별 따위엔 서툴지 사실 이제 나 익숙해졌음 해 마치 또래보다 훨씬 많은 돈을 버는 일 허나 나보다 훨씬 여리디 여린 널 위해 다 큰 어른인 척 좀 할 수 밖에 없는걸 생각해 좀좀좀 지울 수 없어 Have a feel so sweet 익숙해져 버린 네 향기처럼 쓰고 아프지만 내 맘에 가득 담아 흐르는 대로 널 보내줄게 나 너에게 취해 난 이 밤에 취해 니가 모질게 했던 그 기억 속에 그 추억에 헤매 널 찾고 있어 그냥 잊을래 너의 맘도 알고 싶어 boy 그냥 잊어줘 Baby Please don't go 눈 감으면 맴돌아 너와 걷던 길 함께한 시간 이대로 잠들면 oh 오늘 좀 취한 것 같아 잠긴 목소리로 불러도 넌 아무렇지 않게 가줘 나 너에게 취해 난 이 밤에 취해 니가 모질게 했던 그 기억 속에 그 추억에 헤매 널 찾고 있어 그냥 잊을래 너의 맘도 알고 싶어 boy 그냥 잊어줘 Baby Please don't go
2017	LONELY	R&B/Soul	너무 익숙해 이제 매번 끝까지 가네 이건 행복이 아냐 이건 사랑이 아냐 니가 뭘 하든 너에게 맞춰야 하지 널 이해하는 나니까 그냥 또 이렇게 아무 말 안하고 넘어가야 편하겠지 대단한걸 바라는 게 아냐 이제 많은 기대도 하지 않아 다만 끝이 날 까봐 이대론 널 잃을 까봐 너는 이제 내가 쉬워지니 너는 내 걱정들이 부담되니 우리 우리 너무 변했나 봐 Baby baby lonely lonely lonely 이렇게 끝인 거니 왜 이러니 너 자꾸 나만 혼자서 또 외로운 거니 Baby baby lonely lonely lonely 이게 사랑이니 나만 변한 거니 우리 지금 싸움인지 연앤지 우린 toast and butter 처럼 가까웠지 closer than close 갑자기 차가웠지 주된 분위기는 정적 싸늘의 정점 화내고 소리치고 파도가 치는 절정 또 아무렇지 않은 듯 넌 꿇어 앉어 진심이 아닌데도 받아주고 끌어안어 조금만 괜찮아지면 또 그 날이 와 그 날이 오면 내 심장이 빠질 것 같아 대단한걸 바라는 게 아냐 이제 많은 기대도 하지 않아 다만 끝이 날 까봐 이대론 널 잃을 까봐 너는 이제 내가 쉬워지니 너는 내 걱정들이 부담되니 우리 우리 너무 변했나 봐 Baby baby lonely lonely lonely 이렇게 끝인 거니 왜 이러니 너 자꾸 나만 혼자서 또 외로운 거니 Baby baby lonely lonely lonely 이게 사랑이니 나만 변한 거니 우리 지금 싸움인지 연앤지 우리 여기까지만 하고 잊어볼까 그때로 다시 돌아갈 수는 없을까 Lonely my heart 이제 이별만 남았잖아 너도 끝을 준비하잖아 다시 돌아갈 수 없다는 게 너무 아파 Baby baby lonely lonely lonely 이렇게 끝인 거니 왜 이러니 너 자꾸 나만 혼자서 또 외로운 거니 Baby baby lonely lonely lonely 이게 사랑이니 나만 변한 거니 우리 지금 싸움인지 연앤지 With time Everything will be forgotten and so will you That's what's really sad
2017	무제(無題) (Untitled, 2014)	R&B/Soul	나에게 돌아오기가 어렵고 힘든 걸 알아 이제 더는 상처받기가 두렵고 싫은 걸 알아 네가 떠나 버린 그날에도 모진 말로 널 울리고 뒤돌아 서서 후회해 미안해  제발 단 한 번이라도 너를 볼 수 있다면 내 모든 걸 다 잃어도 괜찮아 꿈에서라도 너를 만나 다시 사랑하기를 우리 이대로  너에게 용서받기 보다 죽는 게 더 쉬울지 몰라 이 노래를 불러보지만 내 진심이 닿을지 몰라 네가 행복하기를 바래 그 흔한 거짓말도 못하고 돌아오기만 기도해 미안해  제발 단 한 번이라도 너를 볼 수 있다면 내 모든 걸 다 잃어도 괜찮아 꿈에서라도 너를 만나 다시 사랑하기를 우리 이대로  이제는 끝이라는 마지막이라는 너의 그 맘을 난 믿을 수 없어 I can't let go, cuz you never know 내겐 너 같은 너에겐 나 같은 그런 사랑은 두 번 다시는 없어 Nobody knows… we always know  제발 단 한 번이라도 너를 볼 수 있다면 내 모든 걸 다 잃어도 괜찮아 꿈에서라도 너를 만나 다시 사랑하기를  지금 이 시간이 지나가고 다 잊을 수 있다면 그 기억도 행복했던 추억도 아니 다음 생 에도 너를 만나 다시 사랑하기를 예전 그대로
2017	구차해 (Solo. 문별)	R&B/Soul	내가 왜 널 좋아했을까 생각보다 안 맞는 우리 둘 Uh 친구를 붙잡고 욕하지만 너의 연락 한 통에 Only you Uh 지쳐갈 때쯤이면 넌 꼭 다정해 따뜻해 기대를 주네 내가 필요할 때면 넌 꼭 바쁘대 안돼 혼자가 된 나 네가 있어도 난 아파 보고 싶은데 내가 뭘 어쩌겠어 티 내고 싶지 않아 날 안타깝게 볼까 봐 Yeah 아무래도 난 구차해 구차해 Yeah Uh 멈출 수가 없어 I found you 나만 그런 것 같아 화가나 I don't understand 이 정도 속앓이는 익숙해 동정은 No 하던 대로 해 그게 너다우니깐 맘을 쿡쿡 쑤셔도 말을 툭툭 뱉어도 나 너 하나니깐 이 밤에 맥주 한잔 들고 여전히 신세한탄 중 네가 있어도 난 아파 보고 싶은데 내가 뭘 어쩌겠어 티 내고 싶지 않아 날 안타깝게 볼까 봐 Yeah 아무래도 난 구차해 구차해 Yeah I recognize 한쪽으로 치우친 사이 못 미뤄놔 정리하고 싶어 빨리 짜증나는 밤이네 Love and hate 한 두 번도 아닌데 예민해 Everyday I falling love again 애써 태연하게 구는 내가 싫어 You made it 네가 있어도 난 아파 보고 싶은데 내가 뭘 어쩌겠어 티 내고 싶지 않아 날 안타깝게 볼까 봐 Yeah 아무래도 난 구차해 구차해 Yeah Call me call me everyday everynight Hug me hug me everywhere everytime Love me love me everyday everynight But I'm lonely so lonely 구차해 매일 난 
2017	다라다 (휘인, Jeff Bernat, B.O.)	R&B/Soul	매일 너만 바라보다가 이젠 눈을 감아도 네가 보여 100미터를 달린 것처럼 내 맘은 뛰어 이미 너를 만나러 가는 길은 Singing like 다 다 다라다 다다 다라다 다 다 다라다 다다 다라다 Sing a song on and on 다 다 다라다 on and on Maybe I fall in love with you oh Sunshine gentle breeze you and I 내게 와줘요 어서 안아줘요 꽃이 비처럼 내리는 길을 같이 걸어요 아무 말 않고 보아도 좋아요 그대와 함께라면 잠이 오질 않네요 이 밤이 지나가면 그대를 만나겠죠 달빛도 따뜻해요 그대만 생각하면 내 피아노만 켜면 다 다 다라다 다다 다라다 다 다 다라다 다다 다라다 Sing a song on and on 다 다 다라다 on and on You’re the one and only that I give my everything I feel you every moment that I breathe 내게 와줘요 어서 안아줘요 꽃이 비처럼 내리는 길을 같이 걸어요 아무 말 않고 보아도 좋아요 그대와 함께라면 이 밤이 지나면 When the morning comes 그댈 만나겠죠 I want to hold you baby 그대만 생각하면 달빛도 따뜻해요 I never felt like this before I feel you every night and morn Now we walk along this road together 내게 와줘요 어서 안아줘요 꽃이 비처럼 내리는 길을 같이 걸어요 아무 말 않고 보아도 좋아요 그대와 함께라면 다라 다다 다라 다다다 다라 다다 다라 다다다 아무 말 않고 보아도 좋아요 그대와 함께 라면 
2017	비도 오고 그래서 (Feat. 신용재)	R&B/Soul	비도 오고 그래서 네 생각이 났어 생각이 나서 그래서 그랬던거지 별 의미 없지 오늘은 오랜만에 네 생각을 하는 날이야 일부러 난 너와 내가 담겨 있는 노랠 찾아 오늘은 슬프거나 우울해도 괜찮은 맘이야 어차피 이 밤이 다 지나가면은 별 수도 없이 난 또 한 동안은 널 잊고 살테니까 내 가슴 속에만 품고 살아갈테니까 비도 오고 그래서 네 생각이 났어 생각이 나서 그래서 그랬던거지 별 의미 없지 우산 속에 숨어서 네 집을 지나쳐 그 날의 감정을 다시 느껴보고파서 떨어지는 빗물과 시계 초침 소리가 방 안 가득 채우면 그 때로 난 돌아가 차라리 난 이 비가 그치지 않았음 해 매일 기억 속에 살 수 있게 나 널 아프게 했던 못난 놈이니까 널 다시 품에 안을 자격도 없으니까 비도 오고 그래서 네 생각이 났어 생각이 나서 그래서 그랬던거지 별 의미 없지 우산 속에 숨어서 네 집을 지나쳐 그 날의 감정을 다시 느껴보고파서 우리에게 주어진 행복을 너무 빨리 쓴 것 같아 거기까지 인 것 같아 이 비가 그칠 땐 각자 있던 곳에서 다시 살아가야만 해 비도 오고 그래서 네 생각이 났어 생각이 나서 그래서 그랬던거지 별 의미 없지 우산 속에 숨어서 네 집을 지나쳐 그 날의 감정을 다시 느껴보고파서
2017	Outside (Feat. Beenzino)	R&B/Soul	오늘은 무슨 일이 생길지 궁금해 밖으로 나가면 예쁜 여자들도 많은데 바람에 기대면 어디든 날아갈 것 같애 너와 함께 보고 싶어 새빛둥둥 sunset pretty brown eyes you can call me late at night 지나가는 시간 후회하기 싫어 난 매일 밤 never mind 더 이상 따가운 눈치보기 싫어 뭐 어때 뭐 어때 yeah i’m down for you girl just don’t care 비밀이 생길 것 같아 지금 오늘은 밖으로 나가벼운 기분 내일이면 끝나 so take me into the night I wanna go outside just let me go outside let me go outside just let me go outside take me for a ride take me into the night 어디로든 떠나 느낌 가는 곳 아님 일단 만나서 정해 wherever you want Malibu Santa Monica도 난 너무나 좋아 다 쩔어 get ready to go 오늘따라 거울 보는데 잘 생겼지 yeah yeah 나라를 지키러 가기엔 I’m too sexy damn right 허리에 감은 메이슨 마르지엘라 채찍 거미다리처럼 긴 앞머리 Too edgy 거의 끝났어 내 나갈 채빈 비밀이 없는 삶 살기 힘들어 매일 밤 밖에 나가 상대하기 지겹지 cameras put it down put it down 걷다 보니까 bonita applebum 눈 튀어나와 Outside 난 힘들어 집어넣기가 싫어 lemme go out 퍼부어 hard liquor 못 놓아 아직은 don’t let my freedom go The night is hella young #nofilter 비밀이 생길 것 같아 지금 오늘은 밖으로 나가벼운 기분 내일이면 끝나 so take me into the night I wanna go outside just let me go outside let me go outside just let me go outside take me for a ride take me into the night 어디로든 떠나 느낌 가는 곳 아님 일단 만나서 정해 wherever you want Malibu Santa Monica도 난 너무나 좋아 다 쩔어 get ready to go 오늘 밤 난 운전대를 놓아 밟을 브레이크 없는 내 마음 Swerving Left right Flying straight up to the moon Got me real high Got me for real God speed for real 속력을 내 난 don’t think too much swish pedal to the metal autobahn 정신 줄 놓고 놀아 ibiza gets me high jazz bar in the Cuba chico and Lita 아무도 말리지마 말리지마 말리지마 wanna go outside I wanna go outside let me go outside take me for a ride let me go outside
2017	전야 (前夜) (The Eve)	R&B/Soul	똑바로 봐 What's the situation 당황한 너의 시선 너머 끝내 무너지는 성벽 차츰 밝아오는 새벽 Yeah uh 끝없이 이어지고 있어 무딘 칼날 끝에 잘라내지 못해 계속 반복되는 문제 Yeah 미처 풀지 못한 숙제 높은 벽 앞에 스러지던 작고 약한 바람 소리가 뒤엉켜 폭풍처럼 몰아치는 소릴 들어봐 깨고 부딪쳐야 해 우릴 볼 수 있도록 크게 소리쳐야 해 멀리 번져가도록 여린 빛들이 번져가 긴 어둠을 다 몰아낸 순간 다시 깨어나야 해 새로워진 아침에 오만한 시선들로 날 봐 이미 다른 출발선 위에 앉아 까마득한 거리 Yeah 닿지 않을 듯한 외침 짓밟힌 채로 자라나던 간절한 수많은 꿈들이 보란 듯 담장 너머 피워낸 풍경을 바라봐 깨고 부딪쳐야 해 우릴 볼 수 있도록 크게 소리쳐야 해 멀리 번져가도록 여린 빛들이 번져가 긴 어둠을 다 몰아낸 순간 다시 깨어나야 해 새로워진 아침에 왜곡되는 진실 가르쳐진 거짓 변화의 목소리 파도가 일어 전부 집어삼킬 바다를 만든 건 It's you 깨고 부딪쳐야 해 우릴 볼 수 있도록 크게 소리쳐야 해 멀리 번져가도록 여린 빛들이 번져가 긴 어둠을 다 몰아낸 순간 다시 깨어나야 해 새로워진 아침에
2017	어디야?	R&B/Soul	아무 일도 아닐지도 모르지만 사실 나 요즘 널 보면 불안해 왜 이래 왜 이래 아닐지도 몰라 왜 이래 왜 이래 아닐지도 몰라 잠깐만 네가 내게서 눈을 떼도 그게 1초라도 나는 화가 나 난 몰라 난 몰라 자꾸 왜 이럴까 난 몰라 난 몰라 자꾸 왜 이럴까 점점 커져버린 내 맘이 널 지치게 했나 네가 멀어진 걸 느껴 I never knew 어디야 아무 연락 없잖아 어디야 도대체 몇 번째야 하루 종일 너를 기다리는데 이런 내 맘 너는 몰라 어디야 지금 네가 필요해 이러다 나도 지칠지 몰라 하루 종일 울렸었던 네 전화 처음 네가 너무 그리워 어디야 어디야 자꾸 불안해지잖아 I hate you I love you 나 또 혼자야 혼자 있는 내게 먼저 다가와서 관심 없던 날 흔들어 놓더니 이럴걸 이럴걸 그때 왜 그랬어 이럴걸 이럴걸 그때 왜 그랬어 다른 남자들과 너는 다르다고 밀어내는 날 꼭 안아주더니 Love me more Love me more 처음으로 돌아와 Love me more Love me more 처음으로 돌아와 점점 커져버린 내 맘이 널 지치게 했나 네가 멀어진 걸 느껴 I never knew 어디야 아무 연락 없잖아 어디야 도대체 몇 번째야 하루 종일 너를 기다리는데 이런 내 맘 너는 몰라 어디야 지금 네가 필요해 이러다 나도 지칠지 몰라 하루 종일 울렸었던 네 전화 처음 네가 너무 그리워 Uh 무의미해 너의 그 표정 속에 내게 더 감정 없다는 건 이제 무감각해 더는 바랄 게 없어 이미 난 벌써 거짓이라도 좋으니 날 봐줘 어서 You 모두 오해라고 말해줘 I need you I want you 날 보고 웃어주던 네가 그리워 지금 내게로 달려와 날 안아줘 어디야 아무 연락 없잖아 어디야 도대체 몇 번째야 하루 종일 너를 기다리는데 이런 내 맘 너는 몰라 어디야 지금 네가 필요해 이러다 나도 지칠지 몰라 지금이라도 내게 달려와서 날 사랑한다고 말해줘 어디야 어디야 자꾸 불안해지잖아 I hate you I love you 나 또 혼자야 
2017	BAE	R&B/Soul	난 너를 너무 원해 허락해 너만의 Bae eh 몰라 몰라 넌 왜 몰라 내 맘 요리조리 도망치고 말이야 단 하루라도 안돼 돼줄래 나만의 Bae eh eh 네가 네가 갖고 싶어 너의 내가 내가 되고 싶어 Bae bae 너는 정말 바보야 아님 내가 바보야 어쩜 그러지 내가 싫은 건지 혹시 다른 사람 있는지 Hey you 다리 예쁜 여자가 좋아 코가 높은 여자가 좋아 너를 도무지 알 수가 없네 너의 그런 점이 난 좋아 나는 그냥 네가 막 좋아 자꾸만 욕심이 나네 누군가 얘를 풀 수 있는 답 알고 있다면 살짝 알려줘요 그저 반만 얼마나 풀고 또 틀리고 공부해야만 알 수 있을까 이 남자 난 너를 너무 원해 허락해 너만의 Bae eh 몰라 몰라 넌 왜 몰라 내 맘 요리조리 도망치고 말이야 단 하루라도 안돼 돼줄래 나만의 Bae eh eh 네가 네가 갖고 싶어 너의 내가 내가 되고 싶어 Bae bae 답이 없는 문제 너에 대해서 풀 때 답답해 이런 건 몰라 나 생각보다 둔해 너에게 나를 맞춰보려 해봐도 틀렸대 그럼 뭐 어쩔 수 있나 이대로 난 안돼 피아노 치는 여자가 좋아 피부 좋은 여자가 좋아 나는 눈썹도 참 예쁜데 너의 옆모습이 좋아 게임하는 네가 좋아 너라면 다 좋은데 누군가 제발 내 맘 전해 줄 수만 있다면 뭐든 해주세요 그저 반만 얼마나 울고 흔들리고 답답해야만 날 안아줄까 이 남자 난 너를 너무 원해 허락해 너만의 Bae eh 몰라 몰라 넌 왜 몰라 내 맘 요리조리 도망치고 말이야 단 하루라도 안돼 돼줄래 나만의 Bae eh eh 네가 네가 갖고 싶어 너의 내가 내가 되고 싶어 Bae bae 이제는 그 맘 그만 더 이상 아닌 척하지 마 너는 나로 가득해 아마 더는 참을 수 없어 난 너를 너무 원해 허락해 너만의 Bae eh 몰라 몰라 넌 왜 몰라 내 맘 요리조리 도망치고 말이야 단 하루라도 안돼 돼줄래 나만의 Bae eh eh 네가 네가 갖고 싶어 너의 내가 내가 되고 싶어 Bae bae 
2017	SUMMER KISS	R&B/Soul	SUMMER KISS 저 바다처럼 Oh 저 하늘처럼 Yeah 저 바다처럼 Oh 저 하늘처럼 Yeah 기억하니 저 파도소리 우리 두 손을 잡고 밤을 지새우던 여름밤 저 하늘에 별을 보며 영원히 변치 않겠다 약속했잖아 나도 모르게 네 넓은 어깨에 머리를 기대는 순간 수줍게 미소를 지으며 내게 점점 다가오는 그 떨림 마치 꿈처럼 저 바다처럼 푸른빛이 우리 둘을 감싸고 Oh 이 모래 위에 새겨 놓은 이름과 아름다운 우리만의 추억 Summer kiss 저 바다처럼 Oh 저 하늘처럼 Yeah 기억하니 저 바람소리 우리 나란히 걷던 너무 아름다운 밤바다 저 하늘에 달을 보며 이 손을 놓지 않겠다고 했었잖아 장난스러운 우리 이야기에 눈이 마주치는 순간 수줍게 미소를 지으며 내게 점점 다가오는 그 떨림 마치 꿈처럼 저 바다처럼 푸른빛이 우리 둘을 감싸고 Oh 이 모래 위에 새겨 놓은 이름과 아름다운 우리만의 추억 Summer kiss 순수한 너의 눈빛 오랜 시간이 흐른대도 변하지 않을 영원한 우리의 사랑을 고이고이 소중히 마음속에 새겨둬 마치 꿈처럼 저 바다처럼 푸른빛이 우리 둘을 감싸고 Oh 이 모래 위에 새겨 놓은 이름과 아름다운 우리만의 추억 Summer kiss Summer kiss 태양의 빛이 우리를 향해 눈부실 정도로 비친 아름다운 여름날의 꿈같은 사랑 얘기 가을이 와도 절대 잊지 못할 매일매일 
