년도	제목	장르	가사
2018	So Good	R&B/Soul	빛을 등진 커튼 사이 작은 바람결에 살랑이는 몸짓 Oh I love 까만 실루엣도 좋아 난 말이 막힐 만큼 좀 더 멀리 아니 깊이 내 머릿속을 헤엄치고서 아득히 퍼진 이 느낌 뭐였니 사랑이라는 이름이 맞겠지 스며든 그 향기가 좋아 이 기분이 좋아 가까이 와 이미 빠져들어 고요한 파도가 쳐 넌 나에게로 가득 번지고 난 뛰어들어 맘은 넘쳤어 온전히 깊은 울림인 걸 귓가를 간지럽혀 넌 나를 채워 맘은 넘쳤어 Um 이대로 So good so good to me So so so so good now So good So good 들뜬 나를 어루만져 그 손길 난 사로잡혀 잉크같이 한 방울씩 하루하루 번져가는 너 점점 난 너라는 짙은 색을 입어가 때로는 은은히 모르는 새 이 시작은 중요하지 않아 오직 지금이야 끌리잖아 이미 빠져들어 고요한 파도가 쳐 넌 나에게로 가득 번지고 난 뛰어들어 맘은 넘쳤어 온전히 깊은 울림인 걸 귓가를 간지럽혀 넌 나를 채워 맘은 넘쳤어 Um 이대로 So good so good to me 말해줘 여러 번 여러 번 너도 내게만 속삭여 요동치는 머릿속은 너로 가득 차서 정신없고 감출 수 없게 해 난 너를 원해 퍼져가 흘러든 감정 벗어날 수 없어 이미 깊이 빠져 마음에 나를 맡겨 넌 나에게로 가득 번지고 난 뛰어들어 맘은 넘쳤어 온전히 작은 숨결은 또 귓가를 간지럽혀 넌 나를 채워 맘은 넘쳤어 이대로 So good so good to me So so so so good now So good so good to me 
2018	벌써 크리스마스	R&B/Soul	첫눈이 내려와 눈을 감았더니 내게로 다가오네 겨울이 내 맘에 불어오는 바람은 너를 데려와 단숨에 나를 헝클어 너라는 겨울이 세상이 온통 하얗던 내 눈에 너만 보이던 그 겨울 그때의 네가 눈앞에 내려와 I need you I want a Christmas day with you 눈이 내리는 오늘밤 너와 둘이 손잡고 걷고 싶은데 I miss you I want a Christmas time with love 너로 가득한 이 순간 크게 너를 부르면 당장 내게 올 것 만 같아 너의 따뜻한 손 입가에 미소 날 보던 눈까지 더 선명해져 익숙한 너의 그 향기까지도 내 맘 전했을까 흩날리는 눈꽃이 오늘은 더 네가 그리워 내 맘 너는 알까 종소리 울려 퍼지던 내 옆에 웃고 있었던 그 겨울 그때 그곳에 지금 나 서있어 I need you I want a Christmas day with you 눈이 내리는 오늘밤 너와 둘이 손잡고 걷고 싶은데 I miss you I want a Christmas time with love 너로 가득한 이 순간 크게 너를 부르면 당장 내게 올 것 만 같아 나 추억을 걷다 보면 꼭 네가 돌아와 내게 다시 안길 것 같아 I need you I want a Christmas day with you 눈이 내리는 오늘밤 온 세상이 하얗게 너로 물들어 I miss you I want a Christmas time with love 너로 빛나는 이 순간 크게 너를 부르면 당장 내게 올 것 만 같아 너에게도 눈이 내릴까 
2018	So In Love	R&B/Soul	Give a little bit take a little bit Touch a little bit kiss a little bit Oh white Christmas Learn a little bit grow a little bit Watch a little bit show a little bit It's real Christmas yeah 새빨간 상자 속에 내 맘을 담아 넣어 예쁘게 포장해 woo hoo hoo 너에게 전할 거야 포근한 겨울 밤 종소리 들려 와 새하얀 꿈처럼 추억이 쌓여가 너무 아름다워 beautiful baby 가장 큰 선물이 내 곁에 있어서 Love So in love 찬란한 겨울 밤 까맣게 짙어진 하늘에 널 닮은 별이 반짝인 밤 매일이 오늘만 같기를 바라면 욕심인 걸까 추위도 잊은 이 밤 너라는 온기 속에 따스해 지는 걸 woo hoo hoo 사랑을 속삭인 밤 포근한 겨울 밤 종소리 들려 와 새하얀 꿈처럼 추억이 쌓여가 너무 아름다워 beautiful baby 가장 큰 선물이 내 곁에 있어서 Love So in love 찬란한 겨울 밤 상처도 다 감싸 줄게 영원을 약속해 Forever I LOVE YOU란 말론 부족해 1분의 1초까지 special 온 세상 하얗게 물든 이 밤 내 곁에 너 하나면 충분해 이 순간 fall in love is real 고요한 겨울 밤 가만히 속삭여 진심을 담아서 촛불에 비춘 밤 난 항상 고마워 beautiful baby 너라는 기쁨이 내 안에 있어서 Love So in love 찬란한 겨울 밤 포근한 겨울 밤 종소리 들려 와 새하얀 꿈처럼 추억이 쌓여가 너무 아름다워 beautiful baby 가장 큰 선물이 내 곁에 있어서 Love So in love 찬란한 겨울 밤 너와 트리에 별 달 생각하니 설레 어릴 적 까치발 들며 별 달던 때 그때가 그리워 이맘 때쯤이면 하지만 이번엔 너로서 무르익어 마지막 장만 남은 추운 이 겨울도 아깝지 않아 고마워 너란 선물로 Love so in love Im in love with you Merry Christmas 
2018	THE LAST HOLIDAY	R&B/Soul	추운 온도에 얼어붙은 손을 내게 내밀어 따뜻한 커피와 추억들을 나눠줄래 떨리는 겨울이지만 여전히 가슴속에 품은 포근한 마음 기억 속에 남아있는 너와 나 또 날 설레게 해 하얀 눈꽃이 내려올 때 너무 행복했던 Memory 다시 느껴지는 그때의 감정 잊지 못할 것 같아 포근한 기억이 날 깨워줘 거리의 화려한 불빛들과 내 옆에 제일 빛나는 너와 새롭게 쌓여갈 추억 속에 함께해줘 길어진 이 밤의 하늘에 더 반짝이는 별이 날 비추고 수많은 고민들 속에 널 위한 선물 몰래 준비를 했어 떨리는 겨울이지만 여전히 가슴속에 품은 포근한 마음 추억이 될 이 순간의 하루가 또 날 설레게 해 하얀 눈꽃이 내려올 때 너무 행복했던 Memory 다시 느껴지는 그때의 감정 잊지 못할 것 같아 포근한 기억이 날 깨워줘 너에게 숨겨둔 나만의 비밀 얘기를 해줄까 수많은 기도 속에 간절히 바래 왔었던 건 그건 바로 너뿐이야 하얀 눈꽃이 내려올 때 너무 행복했던 Memory 다시 느껴지는 그때의 감정 잊지 못할 것 같아 포근한 기억이 날 깨워줘 거리에 화려한 불빛들과 내 옆에 제일 빛나는 너와 새롭게 쌓여갈 추억 속에 함께해줘 
2018	올해 제일 잘한 일	R&B/Soul	The best thing I ever did December 1년의 끝을 너와 I remember 우리 추억은 눈처럼 쌓이고 너를 위해 남겨둔 수많은 말이 맴돌아 떨리는 걸 늘 외롭기만 했었던 쓸쓸했었던 12월이 이젠 외롭지 않아 내가 올해 제일 잘한 일 너를 만난 것 너를 만난 것 너를 만난 것 내가 올해 안한 일 중에 제일 잘한 일 너와 헤어지지 않은 것 함께 있는 것 All I wanna do All I wanna do 이대로 이대로 이대로 이대로 너와 영원히 둘이 All I wanna do All I wanna do 이대로 이대로 이대로 이대로 변하지 않고 우리 나는 모르겠는데 자꾸 티가 나는지 친구들이 놀려 하루 종일 입이 귀에 걸쳤다고 혼자 있어도 내 뒤에 네가 있는 것처럼 느껴 자꾸 귀가 빨개지는 걸 어떡해 계속 널 생각해 늘 외롭기만 했었던 쓸쓸했었던 12월이 이젠 외롭지 않아 내가 올해 제일 잘한 일 너를 만난 것 너를 만난 것 너를 만난 것 내가 올해 안한 일 중에 제일 잘한 일 너와 헤어지지 않은 것 함께 있는 것 올해를 Little by little 보내면서 수많은 일을 의미를 떠올려봐도 왜 모두 너와 함께한 순간들뿐인지 나 왠지 사랑에 빠졌나 봐 내가 올해 제일 잘한 일 너를 만난 것 너를 만난 것 너를 만난 것 내가 올해 안한 일 중에 제일 잘한 일 너와 헤어지지 않은 것 함께 있는 것 All I wanna do All I wanna do 이대로 이대로 이대로 이대로 너와 영원히 둘이 All I wanna do All I wanna do 이대로 이대로 이대로 이대로 변하지 않고 우리 The best thing I ever did The best thing I ever did 
2018	첫눈에	R&B/Soul	먼 미래의 날씨 같애 예측 불가해 맑았음 해 내 꿈인데도 너만은 왜 뜻대로 안 돼 대체 뭔데 나의 생각과 맘을 다 이미 알고 일부러 반대로 말하고 너는 행동하는 건지 첫눈 내릴 어느 날엔 널 안고 있을까 하얀 배경이 너의 맘에 날 데려가 줄까 온 세상이 너로 뒤덮이면 내 세상은 너의 것이 되고 이 기분은 오감 그 이상의 무언가 넌 그걸 별 노력 없이도 참 무심하게 이끌어내고 날 걷게 해 네가 있는 곳으로 너의 생각과 맘을 다 알고 싶어 한 번의 미소도 눈물마저도 내 것이고 싶어 첫눈 내릴 어느 날엔 널 안고 있을까 하얀 배경이 너의 맘에 날 데려가 줄까 난 널 위해 녹아도 돼 네가 뜨거운 여름이라 해도 뛰어들게 그 순간 네 두 눈 속에 내가 영원히 내리길 바래 첫눈 내릴 어느 날엔 널 안고 있을까 하얀 배경이 너의 맘에 날 데려가 줄까
2019	봄 (feat. 산다라박)	R&B/Soul	Pull me down 끝없이 날 깊은 어둠 그 속으로 Baby Lay me down 내 떨리는 두 손을 네게 묶여버린 채로 나만 혼자인 거 같아 이대로 다 잊혀져버릴 것 같아 나 깨어있는 이 시간이 너무나도 괴로워 always Oh Oh Oh 우울할 때면 Oh Oh Oh 어느새 또 나도 모르게 너를 찾아 헤매는 내가 너무 미웠죠 Oh Oh Oh 바보처럼 또 Oh Oh Oh 울고 있으면 봄바람에 내 맘이 전해질까봐 나에게도 봄 다시 봄이 올까요 아름다운 꽃 맘에 꽃이 필까요 이 차가운 바람이 지나고 내 마음이 녹아내리면 다시 봄 내 마음에도 봄 봄 봄이 올까요 You pull me down but I'm all right You make me cry but I'm all right 너란 추억은 다시 lay me down 언제 울었냐는 듯 make me laugh 이제 곧 괜찮아질 거야 시간이 지나가면 yeah 떠나간 빈자리가 아직은 내게는 크지만 뭐 yeah 찬바람이 지나가면 내 맘에도 봄이 오겠지 뭐 Oh Oh Oh 우울할 때면 Oh Oh Oh 어느새 또 나도 모르게 너를 찾아 헤매는 내가 너무 미웠죠 Oh Oh Oh 바보처럼 또 Oh Oh Oh 울고 있으면 봄바람에 내 맘이 전해질까봐 나에게도 봄 다시 봄이 올까요 아름다운 꽃 맘에 꽃이 필까요 이 차가운 바람이 지나고 내 마음이 녹아내리면 다시 봄 내 마음에도 봄 봄 봄이 올까요 그대가 내게 준 이 아픔이 지나가고 내 두 볼에 흐르는 이 눈물이 마르면 나에게도 봄 아름다운 꽃 이 차가운 바람이 지나고 내 마음이 녹아내리면 다시 봄 내 마음에도 봄 봄 봄이 올까요
2019	25 (Solo 휘인)	R&B/Soul	어렸을 때 호기심 많고 덜렁대 25 여전히 칠칠맞은 나이 툭하면 눈물이 나던 그때완 조금은 달라졌어 세상도 많이 변해버렸네 난 또 작아지려 해 어쩔 땐 난 커버리기 싫은데 꾸밈없던 날처럼 내 얘길 하고 싶은데 어려워 I wanna take a look around and every time I try to fly high 꿈을 꾸던 모든 게 선명하게 그려져 느려지는 걸음도 가볍게 느껴져 햇살이 비칠 때 그림자도 짙어져 새파랗게 물들어 늘어지네 모든 게 쏟아져 흘러넘쳐 잠시 또 덩그러니 앉아 익숙해져 버린 지금도 나쁘지 않아 포근한 바람도 불어오니까 어쩔 땐 난 커버리기 싫은데 꾸밈없던 날처럼 내 얘길 하고 싶은데 어려워 I wanna take a look around and every time I try to fly high 꿈을 꾸던 모든 게 선명하게 그려져 느려지는 걸음도 가볍게 느껴져 고양이와 아웅다웅 빼곡하게 채운 낙서 이리저리 늘어놓은 미니어처 고양이와 아웅다웅 빼곡하게 채운 낙서 이리저리 늘어놓은 미니어처 
2019	그건 아마 우리의 잘못은 아닐 거야	R&B/Soul	사실은 나도 잘 모르겠어 불안한 마음은 어디에서 태어나 우리에게까지 온 건지 나도 모르는 새에 피어나 우리 사이에 큰 상처로 자라도 그건 아마 우리의 잘못은 아닐 거야 그러니 우린 손을 잡아야 해 바다에 빠지지 않도록 끊임없이 눈을 맞춰야 해 가끔은 너무 익숙해져 버린 서로를 잃어버리지 않도록 나도 모르는 새에 피어나 우리 사이에 자주 아픔을 줘도 그건 아마 우리를 더 크게 해줄 거야 그러니 우린 손을 잡아야 해 바다에 빠지지 않도록 끊임없이 눈을 맞춰야 해 가끔은 너무 익숙해져 버린 서로를 잃어버리지 않도록 익숙해진 아픈 마음들 자꾸 너와 날 놓아주지 않아 우린 행복할 수 있을까 그러니 우린 손을 잡아야 해 바다에 빠지지 않도록 끊임없이 눈을 맞춰야 해 가끔은 너무 익숙해져 버린 서로를 잃어버리지 않도록
2019	야간비행 (魔女の花)	R&B/Soul	푸른 빛을 품은 그대를 찾아서 난 지금 어딘가로 야간비행 차가운 바람을 뚫고 날아가 전에 봤던 빛 그 꽃을 찾아서 난 지금 어딘가로 야간비행 확실한 게 없어도 난 달려가 또 해가 뜰 때쯤 내 힘이 사라진대도 그대의 찻잔에 띄워 놓고 싶은 아무도 모르는 그 꽃을 찾아서 그대 몰래 떠나는 나만의 야간비행 꿈에서 봤던 빛 그 꽃을 찾아서 난 지금 어딘가로 야간비행 내일이 없다고 해도 달려가 또 해가 뜰 때쯤 내 힘이 사라진대도 그대의 찻잔에 띄워 놓고 싶은 아무도 모르는 그 꽃을 찾아서 그대 몰래 떠나는 나만의
2019	내가 날 모르는 것처럼 (Feat. 카더가든)	R&B/Soul	돌리기 아쉬운 내내 안타까워만 하는 내 발걸음을 그댄 눈치챘나요 들키기 싫었던 아무도 모르게 했었던 내 모습을 그댄 너무 쉽게 보아버렸네요 묘한 내 기분과 괜한 날씨 탓도 괜히 해보지만 그댄 알고 있는 걸까요 끊이지 않는 질문과 숨기고픈 내 마음 사이에 그댄 날 어디까지 알고 있나요 I don’t know 나를 알면 알 수록 You don’t know 나도 모르겠는 것처럼 I don’t know 나를 알면 알 수록 You won’t know 내가 날 모르는 것처럼 묘한 그 표정과 우물쭈물 했던 나를 생각해봤지만 그댄 알고 있었을까요 끊이지 않던 질문에 숨어버릴 날 알면서 무슨 이유로 나를 필요해 하나요 I don’t know 나를 알면 알 수록 You don’t know 나도 모르겠는 것처럼 I don’t know 나를 알면 알 수록 You won’t know 내가 날 모르는 것처럼 I believe in eyes I believe in your eyes 난 시간을 멈춰서 네게 말하고파 그게 아니면 난 기다리겠지만 순간의 아쉬움이 티나는 건 싫겠지 I don’t know 나를 알면 알 수록 You don’t know 나도 모르겠는 것처럼 I don’t know 나를 알면 알 수록 You won’t know 내가 날 모르는 것처럼
2019	SHE`S FINE	R&B/Soul	아 괜찮다구요 행복하다구요 어쩌면 날 걱정하는 너보다 뭘 기대하나요 울었음 싶나요 그러기엔 난 좀 기분이 좋아요 세상엔 재미있는 게 이렇게 많이 있는데 좋은 노래와 이쁜 옷 그리고 맛있는 것들이 넘치는데 사랑 말고도 난 좀 할 일이 많아 이만 가 볼게요 she's fine she's fine she's fine she's fine she's fine she's fine she's fine she's fine she's fine she's fine she's fine she's fine she's fine 안 하는 쪽에 가까운 연애 난 지금이 편해 뭘 해도 밤에도 잘 자고 커피를 그렇게 마셔대도 하는 일도 다 잘 됐고 효도는 실천 중이고 아쉬운 건 미세먼지와 너의 오지랖뿐 she's fine she's fine she's fine she's fine she's fine she's fine she's fine she's fine she's fine she's fine she's fine she's fine she's fine 그 사람의 소식을 내게 전하지 마세요 궁금하면 내가 직접 전화해볼게요 don't need your help 부탁할게 방해만 말아주시면 진심으로 감사드리겠습니다 she's fine she's fine she's fine she's fine she's fine she's fine she's fine she's fine she's fine she's fine she's fine she's fine she's fine
2019	Help Me	R&B/Soul	Oh 겁 없이 만나봤지 다 똑같아 별거 없지 I wake up feeling dead I need a fresher start 반쯤 풀린 눈 헝클어진 머리 나른 해져 girl ya know mean 재미없어 여긴 라라라라라 오 어지러워 열어줄래 window 이 느낌이 왜 난 좋은지 오 날 따라오는 듯해 저 달빛도 난 내가 떠날 걸 알고 있어 tonight 오늘 밤도 비틀 비틀대 반짝거려 위태로운 듯해 내 몸에 De Niro man what's the matter 난 오늘 밤도 비틀 비틀대 Oh baby what you want is swear I got this And I'm gonna give it to you all of it 오늘 밤에 내게 와줄래 help me baby Don’t talk to me like that baby Come here right now where is it 오늘 밤 널 내게 빌려줘 tonight I’m fucked up 품에 널 안고 잠들고 싶어 Oh why do u like me 입을 맞추지 혼자 괴로운 밤 내 안에 숨겨 줄게 I will never make it promise that I can't keep 오늘 밤에 난 너를 원해 tonight 오늘 밤도 비틀 비틀대 반짝거려 위태로운 듯해 내 몸에 De Niro man what's the matter 난 오늘 밤도 비틀 비틀대 Oh baby what you want is swear I got this And I'm gonna give it to you all of it 오늘 밤에 내게 와줄래 help me baby 내 안에는 내가 너무도 많아 이러다 보면 아침이 오고 침대에 혼자겠지 Man I don't care stay away I’m okay get away 아무도 나를 잘 몰라 네가 나를 볼 땐 나는 어때 오늘 밤도 비틀 비틀대 반짝거려 위태로운 듯해 내 몸에 De Niro man what's the matter 난 오늘 밤도 비틀 비틀대 Oh baby what you want is swear I got this And I'm gonna give it to you all of it 오늘 밤에 내게 와줄래 help me baby 
2019	From Seoul	R&B/Soul	Tokyo to Seoul LA Long time no see ma fans 대충 걸친 T-shirts 구겨 신은 Brand new shoes 뭣 같은 trend I don’t care 굳이 설명이 필요해 Don’t need to FLEX I love myself Bass Okay for real 지금 서있어 On Eiffel When I’m so high 그냥 원하면 줄게 Whatever 똑같은 Frame I don’t care 내 모든 건 시샘이 돼 Don’t need to FLEX I love myself Hi Bonjour Guten Tag I from to Seoul 그 어디가 됐던 핫셀과 필카 뮤직 무비인 laptop 자유의 문을 두드려 매일 밤 welcome 친구들 다 데리고 술 마시고 담배 피고 예술가들은 노는 게 작품이 돼 날 내비 둬 제바루 네 앞가림이나 해 제대로 난 내 멋대로 색을 입히는 카멜레온 I’m from Seoul I’m from Seoul I’m from Seoul I’m from Seoul I’m from Seoul I’m from Seoul I’m from Seoul I’m from Seoul Paris New York to Rome I like the way you move 대충 올린 내 Feed So many lovin' THX a lot 늘 같은 매일 I don’t care 시간은 많아 fly all day Don’t need to FLEX I love myself 가볍게 타는 거야 wave 그렇게 하는 거야 babe 한 손엔 RUM & VODKA We up all night 그걸로 충분해 Don’t need to FLEX For me I’m from Seoul I’m from Seoul I’m from Seoul I’m from Seoul I’m from Seoul I’m from Seoul I’m from Seoul I’m from Seoul 세상은 넓고 내가 안 가본 곳은 많아 하늘을 날아 Let’s go bro 캥거루 와인과 한 손엔 카드가 있다면 여기가 어디든 파라다이스야 나한테 여자는 관심 밖이야 홀라 Luis Bunuel 빠진 탓이야 인생은 멀리서 보면 희극 이랬지 가장 젊은 건 지금 이 순간 it is true I’m from Seoul I’m from Seoul I’m from Seoul I’m from Seoul I’m from Seoul I’m from Seoul I’m from Seoul I’m from Seoul 
2019	If Not Me Who	R&B/Soul	멀리서 나를 보는 눈빛이 I know what u think 별다를 게 없어 bored to death Come out with me baby 어슬렁거리면 넘어가지 내 실루엣이 잘 봐 내가 널 해칠 개 일지 늑대 일지 you wait 넌 날 웬종일 애처럼 만드는 새 놀이터 겁이 없는 cowboy come on ma senorita Girl 너는 위험한 불같아 날 집어삼켜 but I don't care 달려들어 가겠어 네게 들어가겠어 l'm a stupid like a moth Baby take it off for me attractive lady Baby take it off for me attractive lady Baby take it off for me attractive lady Baby take it off for me If not me who If not me who If not me who 내가 아님 누구 If not me who If not me who If not me who 내가 아님 누구 어둠이 존재할 때 별은 빛이나 넌 분명 내가 필요해 불을 꺼 black out 그댄 존재가 고귀해 I know u want me baby 어디를 봐 그렇게 내가 미리 말해줄게 간 볼 생각은 없어 난 매료됐어 fallin’ 졸린 듯한 풀린 눈이 새침데기 스타일 yo 혼내야겠어 들어와 오늘부로 holding Girl 너는 위험한 불같아 날 집어삼켜 but I don't care 달려들어 가겠어 네게 들어가겠어 l'm a stupid like a moth Baby take it off for me attractive lady Baby take it off for me attractive lady Baby take it off for me attractive lady Baby take it off for me If not me who If not me who If not me who 내가 아님 누구 If not me who If not me who If not me who 내가 아님 누구 멀리서 나를 보는 눈빛이 I know what u think 별다를 게 없어 bored to death Come out with me baby Baby take it off for me attractive lady Baby take it off for me attractive lady Baby take it off for me attractive lady Baby take it off for me If not me who If not me who If not me who 내가 아님 누구 If not me who If not me who If not me who 내가 아님 누구 
2019	Easy	R&B/Soul	그래 그건 한 편의 드라마였어 막이 내린 후 끝이 난 걸 보니 시간 지나 네 대사를 다 잊게 됐어 네 말처럼 난 개새끼니까 단지 네게 미친 척을 하던 gatsby 너 없이도 넘치는 하루를 보내 이건 짧은 happening 우연히 널 마주쳤어 타인이 된 듯이 널 봐도 차분해 유독 넌 내게 쉬웠어 넌 그냥 그 정도였어 날 망치던 네 빨간 입술도 이제는 맞출 일 없어 yeah Du rudu du woo Du rudu du woo Du rudu du woo Du rudu du rudu do woo 그녀는 참 예뻐 딱 거기까지 향기 없는 꽃에는 관심 없지 친구들한테 내 욕을 해도 돼 But please don’t call me again baby 심심할 때 보는 그냥 그런 shit 그게 바로 너였어 굿바이 baby Trash I don't care who got me 분명 네게 미친 적이 있어 lady 너의 작은 틀이 날 가두지 못해 이건 짧은 happening 우연히 날 마주쳐도 타인이 된 듯이 모른 척 지나가 유독 넌 내게 쉬웠어 넌 그냥 그 정도였어 날 망치던 네 빨간 입술도 이제는 맞출 일 없어 yeah 유독 넌 내게 쉬웠어 넌 그냥 그 정도였어 날 망치던 네 빨간 입술도 이제는 맞출 일 없어 yeah 
2019	Recognize (Feat. punchnello) (B-BOMB solo)	R&B/Soul	That’s why I love u babe That’s why I call u babe You know I’m fuckin’ babe That’s why I love That’s why I love u I’m gonna fall fall gonna fallin’ down I’m gonna fall fall gonna fallin’ down I’m gonna fall fall gonna fallin’ down I’m gonna fall fall So recognize So recognize So recognize So recognize When I’m feelin so higher So recognize So recognize So recognize So recognize When I’m feelin so higher 난 네게 몸을 뉘었지 거부감 없이 날 만지는 손길에 난 미쳐 Hol up thats why I love you baby mama What you want gucci or prada 어렵지 않아 노력한다 you don’t smoke okay 그럼 끌게 연기를 날리고 어깨에 다시 기대 손을 올려줄래 너와 단둘이 있는 게 내겐 매번 새로운 경험이 돼 That’s why I love you baby One shot drink frank castle shit 알잖아 I’m a kid love comics and game You wanna play games 좋아 원한다면 Tik tok and tik tok 시간이 흐른 다음에 우린 go to space maybe 태양에 뜨겁게 전해지는 서로의 체온 때문에 녹아버리겠어 이제 알겠지 내가 너를 떠올릴 때 이래 recognize me Recognize me 너의 심장 한가운데 들려오는 박동소리 그래 feel like I’m the monster 네가 원하는 대로 다 해줘 Yeah I love the way you are 너도 나를 있는 그대로 받아줘 baby girl keep on doing 이 노래가 끝날 땐 우린 서로를 되새겨 yeah Recognize each other 점점 빠져들어 섞여 가고 있지 이 밤을 밝히는 촛불 안에 유영하는 picture I’m gonna fall fall gonna fallin’ down I’m gonna fall fall gonna fallin’ down I’m gonna fall fall gonna fallin’ down I’m gonna fall fall So recognize So recognize So recognize So recognize When I’m feelin so higher So recognize So recognize So recognize So recognize When I’m feelin so higher So recognize So recognize When I’m feelin so higher So recognize So recognize When I’m feelin so higher 
