년도	제목	장르	가사
2017	그렇더라고요	록/메탈	오늘 많이 힘들었던 하루였죠 그댈 보는 내 가슴이 아리네요 지친 그대를 위해 해줄 수 있는 건 오로지 곁에 있어주는 것 밖에 못해 미안해요 그댄 웃는 게 정말 예쁜 사람이라서 그 미소를 잃었을 때마다 내 전부를 다 줘서라도 다시 또 되돌려주고 싶어요 대신 울어주고 싶고 내가 대신 아파해주고 싶어요 다신 그대의 마음에 상처가 나지 않았으면 해요 누군가를 넘치게 좋아한다는 건 참 신기하게도 그렇더라고요 내가 조금이나마 도움이 되길 원해요 그대에게 있어 난 안식처 이길 바라요 바쁜 하루 중에도 날 떠올리면 편안해질 수 있게 노력 해볼게요 그댄 사실은 너무 여린 사람이라서 소리 없이 아파할 때마다 내 전부를 다 줘서라도 다시 또 웃게 해주고 싶어요 대신 울어주고 싶고 내가 대신 아파해주고 싶어요 다신 그대의 마음에 상처가 나지 않았으면 해요 누군가를 넘치게 좋아한다는 건 참 신기하게도 그렇더라고요 This is a song for you I’m singing for you This is a song for you I’m singing for you 내 모든걸 다 줄게 대신 울어주고 싶고 내가 대신 아파해주고 싶어요 다신 그대의 마음에 상처가 나지 않았으면 해요 누군가를 넘치게 좋아한다는 건 참 신기하게도 그렇더라고요 
2017	혼자야	록/메탈	난 외롭지 않아 밤하늘에 대고 힘없이 말해 오늘은 괜찮아 라고 내게 되물어주는 듯 해 하루를 마치고 돌아와 수고했어 하고 안아줄 누군가가 있어줬으면 좋겠단 생각을 하는 지금도 혼자야 오늘도 달빛아래 혼자야 차가운 밤공기만이 내 곁에 있어 사실 난 외로워 대답 없는 저 밤하늘이 미워 내일 아침에 나갈 때면 오늘도 힘내라고 해줄 누군가가 있어줬으면 좋겠단 생각을 하는 지금도 혼자야 오늘도 달빛아래 혼자야 차가운 밤공기만이 내 곁에 있어 내가 찾는 그 누군가도 같은 밤하늘을 보고 있겠지 혼자야 오늘도 달빛아래 혼자야 차가운 밤공기만이 내 곁에 있어 
2017	쏟아진다	록/메탈	Oh please 왜이러는 걸까 나 바보가 된것 같아 Oh please 왜 너의 앞에선 아무런 말도 못할까 Oh 첫눈에 반해 빠졌다는 말 어디서 어떻게 그 누가 말을해도 믿지 않았던 나는 어디에 지금의 나는 누구 여기서 이렇게 허둥대고 있는게 대체 누군지 난 몰라 단숨에 물 밀듯이 밀려오고 있어 너란 사람이 내게 밤하늘에 저 빛나고 있는 별들처럼 가득히 내게 네가 쏟아진다 Hey Oh please 왜 몸이 갑자기 내 말을 안듣는 걸까 Oh please 왜 나도 모르게 이 가슴이 두근댈까 Oh 운명적으로 만났다는 말 어디서 어떻게 그 누가 말을해도 믿지 않았던 나는 어디에 지금의 나는 누구 여기서 이렇게 허둥대고 있는게 대체 누군지 난 몰라 단숨에 물 밀듯이 밀려오고 있어 너란 사람이 내게 밤하늘에 저 빛나고 있는 별들처럼 가득히 내게 네가 쏟아진다 I'm falling for you woo I'm falling for you woo 단숨에 물 밀듯이 밀려오고 있어 너란 사람이 내게 밤하늘에 저 빛나고 있는 별들처럼 가득히 내게 네가 쏟아진다 Oh please 왜이러는 걸까 네가 쏟아진다 
2017	누군가 필요해	록/메탈	Hello 거기 누구없나 Where is 내게 대답 하나 해 줄 누군가 Is anyone there 사라져 점점 소리 없이 내게서 아무 이유 없이 혹시나 전부 다 착각인 건지 꿈속에서 서로가 서로를 보는 건지 Why am I alone 나를 둘러싼 사람들 속에 Why am I alone 홀로 남겨진 지금 누군가 필요해 지금 누군가 필요해 Hello 아무도 없나요 나를 받아줄 사람은 여기 Is anyone here 다가와 내게 소리 없이 잡아줘 아무 이유 없이 Why am I alone 나를 둘러싼 사람들 속에 Why am I alone 홀로 남겨진 지금 누군가 필요해 지금 누군가 필요해 Ye 침묵을 지키는 사이에 모두를 떠나 보낸 듯해 내 머릿속에 울리는 siren 확실히 이건 아닌 듯해 침묵을 지키는 사이에 모두를 떠나 보낸 듯해 Oh now I got to do something Why am I alone 나를 둘러싼 사람들 속에 Why am I alone 홀로 남겨진 지금 누군가 필요해 지금 누군가 필요해 지금 누군가 필요해 
2017	노력해볼게요	록/메탈	참 못난 나인데 늘 한결같은 얼굴로 기다려주던 그 마음을 이제야 알것같아요 날 있는 그대로 사랑해주던 그 사랑처럼 너의 모습 그대로 안아줄게요 받아줄게요 나 노력해볼게요 힘들때 내 옆에 푹 기대 쉬어도 돼요 그대의 평생 편이 되어 이해해주고 싶어요 날 있는 그대로 사랑해주던 그 사랑처럼 너의 모습 그대로 안아줄게요 받아줄게요 나 노력해볼게요 오 날 있는 그대로 사랑해주던 그 사랑처럼 너의 모습 그대로 안아줄게요 받아줄게요 나 노력해볼게요 
2017	Colors (Final Ver.) (CD ONLY)	록/메탈	난 숨을 죽이고 빛을 집어삼킨 깊은 터널 속에 홀로 남아 한치 앞도 보이지 않는 캄캄한 내 앞길엔 아무것도 보이지 않아 또 느껴지지가 않아 흑백 사진 속 내 모습도 온통 검게 번져버린 나의 세상도 너무 지쳐서 지쳤어 이젠 지겹고 지겨워 곳곳에 보이는 너라는 색은 날 일으켜 유일하게 자기 색을 가지고 있는 너라서 손을 뻗어서 널 잡으려 해봐도 점점 더 멀어져 손을 뻗어서 붉은 노을 빛처럼 날 물들여줘 나를 잃지 않게 Colors Colors 턱 끝까지 숨이 차올라 별을 집어삼킨 깊은 바닷속을 홀로 달려 어렴풋이 보이고 있는 메마른 땅을 적시는 단비 같은 너의 손길에 내 맘이 물들고 있어 곳곳에 보이는 너라는 색은 날 일으켜 이끌어줘 If you could save me 손을 뻗어서 널 잡으려 해봐도 점점 더 멀어져 손을 뻗어서 붉은 노을 빛처럼 날 물들여줘 나를 잃지 않게 Colors Colors 낙서로 가득한 내 세상 그 위에 Colors Colors 새하얀 손으로 너의 색으로 나를 덮어줘 손을 뻗어서 널 잡으려 해봐도 점점 더 멀어져 손을 뻗어서 붉은 노을 빛처럼 날 물들여줘 나를 잃지 않게 손을 뻗어서 손을 뻗어서 나를 잃지 않게 Colors Colors 
2017	태양처럼 (Final Ver.) (CD ONLY)	록/메탈	매일 아침 눈을 뜰 때 제일 먼저 떠오르는 게 내 머릿속엔 오직 너 하나 뿐이야 널 만나 마주 볼 때 두 눈이 마주 칠 때 얼굴이 화끈거려도 Feels so nice Dodododododo 하루도 빠짐없이 난 Dodododododo 너 없인 못살 것 같아 baby Dodododododo 밤새 기다려 난 아침 해가 뜨면 너를 보러 갈 생각에 설레어 가 baby Wa 황홀하게 말없이 쳐다 볼 때 마다 너한테 반해 난 Wa 그저 바라보기만 해도 기분이 좋아 영원하고 파 with you 저 태양처럼 baby 환한 미소로 내 맘을 녹여줘 저 태양처럼 baby 환하게 나의 하루를 밝혀줘 너랑 같이 있는 이 순간이 매우 좋다 라는 내 말엔 오글거린다는 너의 약간 싫은 척 하면서 좋아하는 Smile too great Too Lifted 이러다 Icarus 너 곁에 있을래 날 까맣게 태워도 붙잡을 수 밖에 없는 Reason is Cause I’ll miss you Too damn much Dodododododo 하루도 빠짐 없이 난 Dodododododo 너 없인 못살 것 같아 baby Dodododododo 밤새 기다려 난 아침 해가 뜨면 너를 보러 갈 생각에 설레어 가 baby Wa 황홀하게 말없이 쳐다 볼 때 마다 너한테 반해 난 Wa 그저 바라보기만 해도 기분이 좋아 영원하고 파 with you 저 태양처럼 baby 환한 미소로 내 맘을 녹여줘 저 태양처럼 baby 환하게 나의 하루를 밝혀줘 다 잊고 다 내려놔 날 믿고 딱 따라와 다 잊고 다 내려놔 나 말곤 다 버려봐 Come on 다 잊고 다 내려놔 날 믿고 딱 따라와 다 잊고 다 내려놔 나 말곤 다 버려봐 저 태양처럼 baby 저 태양처럼 저 태양처럼 baby 저 태양처럼 
2017	이상하게 계속 이래 (Final Ver.) (CD ONLY)	록/메탈	새벽에 전화해 데리러 오라 할 때 기다린 듯이 뛰어가고 있는 나 하루도 아니고 내가 왜 이러니 생각해 봐도 계속 끌려 다녀 I don't know I don't know 왜 이러는지 어떻게 대해도 다 받아줘 baby 근데 넌 오늘도 나를 밀어내 밀고 당기는 게임은 stop it baby oh 내가 미쳤나 봐 이건 아니잖아 Ooh ooh 정신 나갔나 봐 이건 아니잖아 Ooh ooh 왜 난 자꾸만 너를 못 놓겠는지 나도 몰라 이상하게 계속 이래 난 자꾸만 네게 돌아가는지 나도 몰라 이상하게 계속 이래 어제가 지나고 오늘이 다 가도 잘 들어갔단 연락조차 없는 너 호구도 아니고 내가 왜 이러니 생각해 봐도 계속 끌려 다녀 I don't know I don't know 왜 이러는지 어떻게 대해도 다 받아줘 baby 근데 넌 오늘도 나를 밀어내 밀고 당기는 게임은 stop it baby oh 내가 미쳤나 봐 이건 아니잖아 Ooh ooh 정신 나갔나 봐 이건 아니잖아 Ooh ooh 지쳐 쓰러질 것 같애 조강지처까진 너한테 안 바래 상관이 아닌 삶의 partner 날 조금만 더 생각해줘 간단해 미쳐 돌겠어도 need ya 애써도 널 못 밀쳐 잊어 버리자 거울에다 몇 번이나 맨날 말해봐도 바뀌는 건 쪼여가는 심장 내가 미쳤나 봐 이건 아니잖아 Ooh ooh 정신 나갔나 봐 이건 아니잖아 Ooh ooh 왜 난 자꾸만 너를 못 놓겠는지 나도 몰라 이상하게 계속 이래 난 자꾸만 네게 돌아가는지 나도 몰라 이상하게 계속 이래 이상하게 계속 이래 
2017	버릇이 됐어 (Final Ver.) (CD ONLY)	록/메탈	너가 떠나간지 꽤 오랜 시간이 흘러 지나갔어 너가 없는 동안에 난 내 곁에 상상의 널 두고 지냈어 팔짱은 언제든 낄 수 있게 손은 주머니 안에 넌 왜 날 이렇게 만들고 놔둬 왜 그랬어 babe 매일이 똑같애 난 쳇바퀴 위를 달리는 기분 제발 좀 바뀌기를 원해도 원하는 대로 안되는게 사람 마음이라 막 가슴이 아려와 습관이란 게 이런 건가 봐 아무도 없는 빈방에서 니가 돌아오길 기다려 널 만지던 내 손버릇 널 향한 손버릇 널 부르던 내 입버릇 널 위한 입버릇 허공에 대고 널 부른다 널 찾아서 손짓을 한다 넌 나의 버릇이 됐어 버릇이 됐어 버릇이 됐어 너와 함께했던 것들이 아직 내게 많이 남아있어 너가 없는데도 곁에 있는 것처럼 또 몸이 반응했어 반지는 언제든 낄 수 있게 바지 주머니 안에 넌 왜 날 이렇게 만들고 나둬 왜 그랬어 babe 너와 매일 약속한 내일은 눈 앞에서 나만 남기고 나에게서 Fadin’ 계속해서 그 빈자릴 채우려 발이 닳도록 달리다 보면 다시 난 제자리 이별 이란 게 이런 건가 봐 아무 일 없었던 것처럼 혼자인 게 또 익숙해져 널 만지던 내 손버릇 널 향한 손버릇 널 부르던 내 입버릇 널 위한 입버릇 허공에 대고 널 부른다 널 찾아서 손짓을 한다 넌 나의 버릇이 됐어 버릇이 됐어 항상 너만 부르던 나의 입버릇 손을 잡을 때면 언제나 손깍지 끼던 난 버릇이 됐어 널 만지던 내 손버릇 널 향한 손버릇 널 부르던 내 입버릇 널 위한 입버릇 허공에 대고 널 부른다 널 찾아서 손짓을 한다 넌 나의 버릇이 됐어 버릇이 됐어 넌 변했어도 난 안 변했어 넌 내게 남아서 버릇이 됐어 넌 변했어도 난 안 변했어 넌 내게 남아서 버릇이 됐어 넌 변했어도 난 안 변했어 넌 내게 남아서 버릇이 됐어 
2017	Free하게 (Final Ver.) (CD ONLY)	록/메탈	All right 눈치만 보다 하루를 보낸 너 할 일은 제껴 두고 나를 따라와 All right 별빛 아래 drive with me tonight 손끝을 스치는 바람을 느껴봐 어디라도 괜찮아 멀지 않아도 좋아 그저 떠나고 있는 이 순간이 좋아 잠시라도 괜찮아 조급할 필요는 없잖아 오늘 밤 다 같이 저 하늘 아래 So free 하게 내일은 걱정 말고 아무 신경 쓰지 말고 So free 하게 우리들뿐이라고 생각해봐 Now now everybody dance Dance dance tonight 다 같이 free하게 Dance dance tonight Now now everybody dance Dance dance tonight 다 같이 free하게 yeah 자 you got a feeling 자유를 느끼러 일단 박차고 일어나서 get together 해 뜨기 전 오늘 밤 turn up 털어 내 All day stress 들어 손은 하늘 높게 흔들어 누가 보든 말든 상관 말어 어차피 놀 거 조금이라도 더 푸는 게 이득이야 비가 와도 괜찮아 흠뻑 젖어도 좋아 그저 춤추고 있는 이 순간이 좋아 밤을 새도 괜찮아 신경 쓸 사람 없잖아 오늘 밤 다 같이 저 하늘 아래 So free 하게 내일은 걱정 말고 아무 신경 쓰지 말고 So free 하게 우리들뿐이라고 생각해봐 Now now everybody dance Dance dance tonight 다 같이 free하게 Dance dance tonight Now now everybody dance Dance dance tonight 다 같이 free하게 yeah Free하게 오늘 밤 모두 잊고 Free하게 오늘 밤은 Let it go Free하게 오늘 밤 모두 잊고 Free하게 oh So free 하게 내일은 걱정 말고 아무 신경 쓰지 말고 So free 하게 우리들뿐이라고 생각해봐 Now now everybody dance Dance dance tonight 다 같이 free하게 Dance dance tonight Now now everybody dance Dance dance tonight 다 같이 free하게 yeah 
2017	리듬 속의 그 춤을	록/메탈	현대 음률 속에서 순간 속에 보이는 너의 새로운 춤에 마음을 뺏긴다오 아름다운 불빛에 신비한 너의 눈은 잃지 않는 매력의 마음을 뺏긴다오 리듬을 춰줘요 리듬을 춰줘요 멋이 넘쳐 흘러요 멈추지 말아줘요 리듬 속의 그 춤을 너의 몸짓에 따라가는 시선 솔직해 머릿속에 그려지는 멜로디 그림처럼 번져 들려온 메아리 나를 위해서라도 계속 춤을 춰줘요 열광하게 만드는 너 더 크게 소리 지를게 오직 너만을 위해 소리 질러 현대 음률 속에서 순간 속에 보이는 너의 새로운 춤에 마음을 뺏긴 다오 아름다운 불빛에 신비한 너의 눈은 잃지 않는 매력의 마음을 뺏긴다오 리듬을 춰줘요 리듬을 춰줘요 멋이 넘쳐 흘러요 멈추지 말아줘요 리듬 속의 그 춤을 킥 드럼 킥킥 드럼 리듬에 몸을 맡겨 부끄럼 없이 즐겨 보는 거야 왼발 오른발 스텝을 밟아 아침부터 저녁까지 쉴 틈 없이 정신 없지 리듬 속의 그 춤을 느낌 충만하게 Let’s go 리듬을 춰줘요 리듬을 춰줘요 리듬을 춰줘요 리듬을 춰줘요 멋이 넘쳐 흘러요 멈추지 말아줘요 리듬 속의 그 춤을 리듬을 춰줘요 리듬을 춰줘요 멋이 넘쳐 흘러요 멈추지 말아줘요 리듬 속의 그 춤을 리듬 속의 그 춤을 그 춤을 춤을 춤을 춤을 마마무 
2018	그러니까 우리	록/메탈	뭘 그리 힘들어했는지 앞으로만 가려 해 사실 난 하나도 괜찮지 않은데 지나간 그 시간들이 우스갯소리 같아 Baby 입 꾹 다물고 Run & Run 너를 품에 안고서 난 뭐가 또 슬픈지 웃다 울다가 또 다시 웃고 노랠 부르지 뜨거웠던 우리 그 시간들 찬란했던 그때 그 추억들 사랑했던 너를 가득 안고 소중했었던 기억 모두 가슴에 영원히 담아 둘게 돌아봐도 오지 않아 게다가 난 하나도 힘들지 않아 그때를 기억해 웃었어 내가 행복했으면 좋겠어 이제 하지 않아 괜찮은 척도 슬플 땐 맘껏 울어 무엇도 내게 남을 테니까 그 시간 안에 그대로 남아있어 나의 모습 그대로 나의 손을 잡고서 넌 할 말이 많은지 웃다 울다가 또 다시 웃고 노랠 부르지 뜨거웠던 우리 그 시간들 찬란했던 그때 그 추억들 사랑했던 너를 가득 안고 소중했었던 기억 모두 가슴에 영원히 담아 둘게 Don’t forget this 네 모습 그대로 If you remember me 그대로 웃어줘 언젠가 다시 만나도 우리 변치 않길 바라 뜨거웠던 우리 그 시간들 찬란했던 그때 그 추억들 사랑했던 너를 가득 안고 소중했었던 기억 모두 가슴에 영원히 담아 둘게 Don’t forget this 네 모습 그대로 If you remember me 그대로 웃어줘 Don’t forget this 네 모습 그대로 If you remember me 그대로 웃어줘 
2018	뜨거운 감자	록/메탈	야 네 형 넌 다시 태어나면 뭐가 되고 싶냐 전 감자요 감자 네 뜨거운 감자 What 어딜 가도 나를 다 알아봐 바로 내 얼굴이 명함이지 일거수일투족 뭘 하든지 하나하나 나를 따라 하지 아주 난리 난리 나 여기 여기 붙어라 살짝 웃기만 해도 기찻길 도미노같이 쓰러지지 아 뜨거워 So high 가끔은 쉬고 싶은데 여기저기 모두 날 불러대지 머리부터 발끝까지 음 여기 너희들 다 파파라치 조명이 환히 비추고 내가 노래를 부르면 다들 반해 나는 뜨거운 감자야 유명한 남자야 내 이름을 불러줘 쉽게 식진 않을 거야 나는 뜨거운 감자니까 쉽게 식진 않을 거야 여기저기 예쁜 여자 모두 Hello Hot 뜨거운 Potato 눈 깜빡하면 마치 화보같이 미소 한 번에 맘을 사지 쉴 틈이 없이 뜨거운 열기 I can’t stop it 아 진짜 좀 내버려 둬 이제 눈치채기 전에 그냥 멈춰 어딜 가든 전부 카니발이 돼 나 진짜 필요해 날 식혀 줄 Issue 비추지 않아도 Alright 가끔은 쉬고 싶은데 여기저기 모두 날 불러대지 머리부터 발끝까지 음 여기 너희들 다 파파라치 조명이 환히 비추고 내가 노래를 부르면 다들 반해 나는 뜨거운 감자야 유명한 남자야 내 이름을 불러줘 쉽게 식진 않을 거야 나는 뜨거운 감자니까 쉽게 식진 않을 거야 여기저기 예쁜 여자 모두 Hello Hot 뜨거운 Potato Is it that It is real 레드 카펫 밟고 먹어 뷔페 갖고 싶으면 가져 We get that Oh got them 날 보고 기겁해 Wait wait wait 우릴 막지 마 넌 하거나 말거나 관심 말아 오늘 이 밤이 지나도 Come back tomorrow 부드럽게 안겨줘 Soft and mellow 혼자 있으면 뭐 할래 내가 필요하다는데 고민은 버릴게 노래는 뜨겁게 여기 다 쓰러지게 조명이 환히 비추고 내가 노래를 부르면 다들 반해 나는 뜨거운 감자야 유명한 남자야 내 이름을 불러줘 쉽게 식진 않을 거야 나는 뜨거운 감자니까 쉽게 식진 않을 거야 여기저기 예쁜 여자 모두 Hello 모두 다 기다리던 나니까 Oh whoo 쉽게 식진 않을 거야 나는 뜨거운 감자니까 쉽게 식진 않을 거야 여기저기 예쁜 여자 모두 Hello Hot 뜨거운 Potato Hot 뜨거운 Potato 
2018	골목길에서	록/메탈	날씨가 많이 추워졌네 널 봤을 때에 이른 봄 향기도 무뎌졌네 버릇처럼 네 향기가 났던 이 거리도 겨울 냄새로 덮여 내 마음도 한층 가벼워졌네 툭하면 나오던 입버릇 죽고 못 살 것 같던 네가 없고 나서야 이 온도를 느껴 금방이라도 울 것 같은 말투 내 손을 꼭 붙잡고 말했지 내게 가지 말라던 내게 가지 말라고 Yeah 나를 미워해도 돼 바보 같지 이제서야 난 그리워해 바뀐 것 없는 이 골목길에서 Woo 걸어가기 조금은 멀던 네 동네 오르막도 힘들지 않았는데 이젠 네가 없는 것만으로 더 힘든 건 왜일까 I miss you 헤어지고 너 몰래 너의 집 앞 골목길에서 서성이다가 달빛처럼 바래진 가로등 불빛 아래서 널 그리워해도 Yeah 딱히 할 말이 있단 건 아니야 그냥 걷다가 보니까 여기야 혹시라도 마주칠까 봐 이런 내 맘을 들킬까 봐 다시 만나고 싶단 건 아니야 그냥 걷다가 보니까 여기야 추억 깃든 골목길에서 Yeah yeah 넌 나 없이 혼자 울곤 했다며 어두워진 길을 외롭게 걷게 했어 내가 일에 바빠 뭐 그리 바빠했을 때 내팽개치곤 이제서야 너의 기억을 주워 담아 이런 핑계 난 다시 찾은 골목길 뻔한 노래 가사처럼 바뀐 건 없는데 난 널 부르는 가수가 됐고 눈앞에 마주할 수 없어 이 노래를 듣고 있어 Yeah Woo 아름다운 이별이 어디 있니 그냥 끝난 거지 더는 물어보지 마 드라마를 봐도 똑같은 사랑 얘기 이별 얘기 I don’t know 헤어지고 너 몰래 너의 집 앞 골목길에서 서성이다가 달빛처럼 바래진 가로등 불빛 아래서 널 그리워해도 Yeah 다시 걸을 수 없는 이 길에서 너와 나눴던 추억을 지웠어 이제 나만 홀로 걷네 네가 보고 싶은 밤에 Yeah 내 발걸음 떨어지는 소리 우연히라도 난 널 보면 돼 이 길을 Don't forget it 여전히 난 잊었다 생각했는데 바보처럼 또 집 앞이야 헤어지고 너 몰래 너의 집 앞 골목길에서 서성이다가 달빛처럼 바래진 가로등 불빛 아래서 널 그리워해도 Yeah 딱히 할 말이 있단 건 아니야 그냥 걷다가 보니까 여기야 혹시라도 마주칠까 봐 이런 내 맘을 들킬까 봐 다시 만나고 싶단 건 아니야 그냥 걷다가 보니까 여기야 추억 깃든 골목길에서 
2018	I Know U Know	록/메탈	오늘 유난히 더 설레어 너도 알고 있는지 서로의 눈빛만 보아도 I Know U Know I Know 모른 척 다가와 눈감아준 너 한 걸음 다가선 나 그대로 멈춘 You and I Can't be better than this Be better than this ya Oh yeah yeah yeah 없던 날도 Remember this way Oh yeah yeah yeah 너와 함께 했던 시간 Oh yeah yeah yeah 어떤 날도 잊지 마 Baby Oh yeah yeah yeah 서로 솔직했던 시간 Yeah yeah 분홍 솜사탕 같은 구름 자연스레 배어 있지 너란 Groove 발맞춰 걷다 보니 Time is tickin’ 너와 나를 멀어지게 만들곤 했지 이게 우리 탓이라곤 말할 수가 없어 네가 어떤 슬픈 눈으로 나를 볼 때 그대로 모든 게 돌아갔으면 해서 아무 말도 하지 못해 아주 뜨거운 상태로 열정이 넘치던 그때의 넌 여전히 남아있어 그대로 Your love on my mind 아주 잠깐만 나를 데려가 줘 시간아 Cause I wanna you and I 모른 척 다가와 눈감아준 너 한 걸음 다가선 나 그대로 멈춘 You and I Can't be better than this Be better than this ya Oh yeah yeah yeah 없던 날도 Remember this way Oh yeah yeah yeah 너와 함께 했던 시간 Oh yeah yeah yeah 어떤 날도 잊지 마 Baby Oh yeah yeah yeah 서로 솔직했던 시간 널 보러 시간을 거슬러 I know I can’t go 여전히 맴돌며 묻고 싶어 너는 어때 이런 설렘 너에 대한 끌림 한순간의 떨림 모든 걸 주고 싶어 Tonight Oh yeah yeah yeah 없던 날도 Remember this way Oh yeah yeah yeah 알고 있잖아 너와 나 You and I Oh yeah yeah yeah 어떤 날도 잊지 마 Baby Oh yeah yeah yeah Can’t be better than like this 모른 척 다가와 눈감아준 너 한 걸음 다가선 나 그대로 멈춘 You and I Can't be better than this 
2018	이보다 좋을까	록/메탈	다 알고 있어 Don’t know why 어떤 표정을 지을지 말지 꿰뚫어 보이나 봐 왜인지 모르겠어 무뚝뚝하게 널 대하는 게 아니야 널 너무 좋아하는데 네 앞에 서면 Olaf가 돼버려 훅 들어오지 마 Will be stupid 따뜻한 듯한 너의 그 미소가 날 부른 듯 찾는 듯 설레게 해 너가 웃는 모습 I like it 살짝 맴도는 너의 향기 어느 것 하나 난 만족해 Yeah I am talking to you girl come on 널 바라보는 눈빛 이보다 좋을까 잡은 두 손 놓지 않을게 날 사랑한단 말들 이렇게 좋을까 우리 항상 변하지 말길 깨끗한 듯한 너의 그 말들이 날 올렸다 내렸다 떨리게 해 너의 입 모양 I like it 살짝 긴장한 나의 몸짓 어느 것 하나 난 만족해 Yeah I am talking to you girl come on 널 바라보는 눈빛 이보다 좋을까 잡은 두 손 놓지 않을게 날 사랑한단 말들 이렇게 좋을까 우리 항상 변하지 말길 천천히 갈래 널 놓치지 않게 네 걸음 맞춰 Sweet and sleek 달에서 춤을 추듯 유연하게 해 네 맘에서 날 유영하게 해 이보다 좋을까 아름다워 너와 함께라면 이른 봄 향기가 나 따뜻한 겨울 넌 나만 보는 바보 넌 나만 떠올려 어딜 가도 나만 바라봐 난 너만 아는 바보 내 맘에 가득해 서로 아끼고 사랑해주길 널 바라보는 눈빛 이보다 좋을까 잡은 두 손 놓지 않을게 날 사랑한단 말들 이렇게 좋을까 우리 항상 변하지 말길 
