년도	제목	장르	가사
2016	Cool Hot Sweet Love	R&B/Soul	Cool Hot Sweet Love 너란 트랙 위 나를 얹을게 어떤 멜로디일지 상상을 해봐 단순할수록 더욱 아름다운데 손댈수록 원래의 빛을 잃어가 때론 초승달처럼 차가운 너를 안아 뜨겁게 차르르 녹이면 마침내 달디 단 네 안의 그것 심플하고 아름다운 그 맛 보겠지 그건 Cool Hot Sweet Love 우리만의 Cool Hot Sweet Sweet Love 하얀 날개 펼쳐 구름 위에 선 듯 아찔한 이토록 순수한 Emotion 그저 널 사랑하고 있어 노랗게 달을 채워 나도 따라 커져 마침내 우린 완전하게 돼 차갑고 뜨겁고 달아 우리만의 Cool Hot Sweet Love Co-Cool Ho-Hot Sweet Love Cool Cool Hot Hot Sweet Sweet Love Co-Cool Ho-Hot Sweet Love Cool Cool Hot Hot Sweet Sweet Love 아이스크림 위에 살짝 부어진 커피 순식간에 내 혀를 사로잡았어 사르르 녹으며 날 지배해 올 때 내가 정말 원한 것을 알았어 사랑은 복잡하지 않나 봐 아무 거짓말 없이 전부 다 표현할 때만 달디 단 네 안의 그것 심플하고 아름다운 그 맛 보겠지 그건 Cool Hot Sweet Love 우리만의 Cool Hot Sweet Sweet Love 하얀 날개 펼쳐 구름 위에 선 듯 아찔한 이토록 순수한 Emotion 그저 널 사랑하고 있어 파란색 네 숨결에 핑크빛 체온에 마침내 거절할 수 없게 돼 차갑고 뜨겁고 달아 우리만의 Cool Hot Sweet Love 상상도 못했겠지 내가 모든걸 던져 당신을 선택할 거란 걸 놀라지 마요 지금 시작된 거야 하얀 날개 펼쳐 구름 위에 선 듯 아찔한 이토록 순수한 Emotion 그저 널 사랑하고 있어 파란색 네 숨결에 핑크빛 체온에 마침내 거절할 수 없게 돼 차갑고 뜨겁고 달아 우리만의 Cool Hot Sweet Love We got a Co-Co-Cool Hot Sweet Love We got a Co-Co-Cool Hot Sweet Love We got a Co-Co-Cool Hot Sweet Love 노랗게 달을 채워 나도 따라 커져 마침내 우린 완전하게 돼 차갑고 뜨겁고 달아 우리만의 Cool Hot Sweet Love Co-Cool Ho-Hot Sweet Love Cool Cool Hot Hot Sweet Sweet Love Co-Cool Ho-Hot Sweet Love Cool Cool Hot Hot Sweet Sweet Love 
2016	Light Me Up	R&B/Soul	Tonight I wanna light up the world between you and me All I wanna do 눈을 뜬 것 같아 구름이 걷히고 해님이 뜬 거죠 그대가 나를 깨워 작은 내 불을 밝혀 환하게 했어요 So 한 걸음 내디뎌 볼게 가까이 더 갈게 그림자는 지워 버릴게 Ooh Ah Come here boy Wanna talk to you 우린 서로를 더 알아야 해요 서로 고백해요 I'm in love Ooh boy Come and Light Me Up 캄캄한 세상을 밝혀줘 Light me Light me 자 손을 잡아 줘 Ooh boy 커질수록 더 환히 빛난 사랑의 빛이죠 영원하길 원해 빛은 커져가 새벽처럼 와 어두웠던 밤 한 순간 사라지니 Oh 난 뭐가 두려울까요 원하고 가졌죠 이 순간을 Light Me Up 난 보았죠 눈 앞에 쏟아지는 빛을 사랑에 빠진 눈에 우리가 비쳐요 너무 아름답죠 So 한 걸음 내디뎌 볼게 가까이 더 갈게 그림자는 지워 버릴게 Ooh Ah Come here boy Wanna talk to you 우린 서로를 더 알아야 해요 서로 고백해요 I'm in love I'm in love 매일 더 많은 얘길 듣고 싶어요 서로 나누는 거에요 또 나의 얘기도 Ooh boy Come and Light Me Up 캄캄한 세상을 밝혀줘 Light me Light me 자 손을 잡아 줘 Ooh boy 커질수록 더 환히 빛난 사랑의 빛이죠 영원하길 원해 빛은 커져가 새벽처럼 와 어두웠던 밤 한 순간 사라지니 Oh 난 뭐가 두려울까요 원하고 가졌죠 이 순간을 Light Me Up 날 외롭게 눈물도 흘리게 말아요 이 불빛에 내 전부를 태워버린걸요 You make me so crazy 난 조금 어지러워져 꼭 안아요 Ooh boy Come and Light Me Up 캄캄한 세상을 밝혀줘 Light me Light me 자 손을 잡아 줘 Ooh boy 커질수록 더 환히 빛난 사랑의 빛이죠 영원하길 원해 빛은 커져가 새벽처럼 와 어두웠던 밤 한 순간 사라지니 Oh 난 뭐가 두려울까요 원하고 가졌죠 이 순간을 Light Me Up 영원히 켜 둘게요 Light Me Up 
2016	7월 7일 (One Of These Nights) (De-Capo Ver.)	R&B/Soul	그냥 꿈에서 깬 것뿐이야 또 다시 까마득한 저 슬픈 별 하나 잘 가 서툴게 인사하고 뒤돌아서 오는 길은 참 멀기도 하다 같은 시간에 Just for a minute 같은 공간에 Stay for a minute 그 짧았던 순간 모든 게 너와 날 위해 멈춰있던 그 순간 왜 그게 기적인 걸 몰랐을까 오래된 Story와 그 날에 멈춘 나 사랑한 시간보다 더 오래 이별하는 중인걸 은하수 너머에 아득히 먼 곳에 하얀 우리의 기억을 건너는 나 꿈속이라도 괜찮으니까 우리 다시 만나 One Of These Nights 우리 다시 만나 One Of These Nights Oh 난 서둘러 잊지 못해 달력을 넘겨도 난 늘 제자리니까 너의 눈빛에 Just for a minute 스친 손끝에 Stay for a minute 그 짧았던 순간 모든 게 너와 날 위해 멈춰있던 그 순간 난 그 때 반짝이게 된 것 같아 오래된 Story와 그 날에 멈춘 나 사랑한 시간보다 더 오래 이별하는 중인걸 은하수 너머에 아득히 먼 곳에 하얀 우리의 기억을 건너는 나 꿈속이라도 괜찮으니까 Baby One of these days One of these years 기다림은 내겐 사소한 일일 뿐인 걸 오래된 Story와 그 날에 멈춘 나 사랑한 시간보다 더 오래 이별하는 중인걸 은하수 너머에 아득히 먼 곳에 하얀 우리의 기억을 건너는 나 꿈속이라도 괜찮으니까 우리 다시 만나 One Of These Nights 우리 다시 만나 One Of These Nights 
2016	7월 7일 (One Of These Nights) (Joe Millionaire Ver.)	R&B/Soul	그냥 꿈에서 깬 것뿐이야 또 다시 까마득한 저 슬픈 별 하나 잘 가 서툴게 인사하고 뒤돌아서 오는 길은 참 멀기도 하다 같은 시간에 Just for a minute 같은 공간에 Stay for a minute 그 짧았던 순간 모든 게 너와 날 위해 멈춰있던 그 순간 왜 그게 기적인 걸 몰랐을까 오래된 Story와 그 날에 멈춘 나 사랑한 시간보다 더 오래 이별하는 중인걸 은하수 너머에 아득히 먼 곳에 하얀 우리의 기억을 건너는 나 꿈속이라도 괜찮으니까 우리 다시 만나 One Of These Nights 우리 다시 만나 One Of These Nights Oh 난 서둘러 잊지 못해 달력을 넘겨도 난 늘 제자리니까 너의 눈빛에 Just for a minute 스친 손끝에 Stay for a minute 그 짧았던 순간 모든 게 너와 날 위해 멈춰있던 그 순간 난 그 때 반짝이게 된 것 같아 오래된 Story와 그 날에 멈춘 나 사랑한 시간보다 더 오래 이별하는 중인걸 은하수 너머에 아득히 먼 곳에 하얀 우리의 기억을 건너는 나 꿈속이라도 괜찮으니까 Baby One of these days One of these years 기다림은 내겐 사소한 일일 뿐인 걸 오래된 Story와 그 날에 멈춘 나 사랑한 시간보다 더 오래 이별하는 중인걸 은하수 너머에 아득히 먼 곳에 하얀 우리의 기억을 건너는 나 꿈속이라도 괜찮으니까 우리 다시 만나 One Of These Nights 우리 다시 만나 One Of These Nights 
2016	사실은 (The Truth Is)	R&B/Soul	우리 헤어지고 잠들기 전에 니가 그리워서 눈물 흘린 적은 없어 나 요즘 잘 나가 쉴 새 없이 여자한테 연락 와서 니 생각은 나지도 않아 내 옆에 있는 빈자리 원래 니가 주인이지 그 자릴 여러 명으로 채워 넣어버렸지 나 괜찮아 괜찮아 요즘 이뻐졌더라 하나도 배 안 아파 근데 girl 솔직히 말하자면 내가 고백할게 있어 진심이 정확히 어떤 건지 지금 말해줄게 사실은 girl 난 아직까지 몇 시간씩이나 몰래 니 인스타를 훔쳐봐 사실은 girl 난 자주 그래 아직까지 친구 통해 니 소식을 물어봐 Baby 좀 초라하지만 내가 그러는 이유는 사실은 girl 난 아직도 널 사랑해 다른 남자랑 데이트하고 있을 때 장염에 걸리길 바래 니가 볼 일을 다 봤을 때 화장실에 화장지가 없길 바래 충전기를 잃어버린 상태에서 배터리 없길 바래 핸드폰 떨어트려서 액정 깨지길 바래 마법에 걸린 그런 날에 고통이 더욱더 심하길 바래 근데 girl 솔직히 말하자면 난 너 원망하지 않아 너를 놓친 내가 한심해서 내 자신을 더 원망해 Oh girl 나 아직까지 땅을 치며 매일매일 널 놓친 걸 후회해 사실은 girl 나는 바보처럼 니가 돌아오는 날만 기다리게 돼 Baby 좀 초라하지만 내가 그러는 이유는 사실은 girl 난 아직도 널 사랑해 사랑해 사랑해 사랑해 사랑해 사랑해 사랑해 1 2 3 4 girl 솔직히 말하자면 니가 떠난 그날부터 나 홀로 어쩔 줄 몰라서 정신을 못 차리겠어 Oh girl 니가 없는 삶을 살아가는 건 의미 없다고 생각해 사실은 girl 난 자신 없어 니가 아니라면 나는 다시는 사랑 못해 너 없인 난 초라해 Oh girl 그 이유는 니가 날 날 완성시켜줬어 제발 돌아와 줘 사실은 내가 괜히 찔려서 너를 의심하고 더 못해줬어 Im so sorry so sorry so sorry
2016	D (half moon) (Feat. 개코)	R&B/Soul	Love love the stars Love love the moon 별 다를 것 없이 똑같은 공기 똑같은 침대에서 보이는 천장까지 왜 별 이유 없이 공허한 건지 그저 몇 시간 째 멍만 때리는 게 처음에는 배가 고픈가 했었는데 No way no way no way 요새는 칸예 새 앨범을 들어도 뻔해 뻔해 뻔해 TV를 틀어 놓은 채 채널만 돌려 보네 But bae 별 의미 없네 다 너의 반 반 반의 반의 반도 채워주질 못 하네 채워지지가 않네 Yeah 딱 너의 반 반 반의 반이라도 내게 남았더라면 이렇게 붕 떠있지는 않을 텐데 너 없는 밤도 달은 떴다는데 보이지 않아 네 생각에 가려진 채 Yeah 마음이 기운 채로 판단이 설 리가 너 하나 없다고 내가 이럴 리가 없는데 자꾸 그 때로 또 되감기 돼 네가 있던 자리 그 자리 위 밤하늘까지 보여 저 반 쪽 짜리 달이 딱 지금 나의 모습 같지 다 너의 반 반 반의 반의 반도 채워주질 못 하네 채워지지가 않네 Yeah 딱 너의 반 반 반의 반이라도 내게 남았더라면 이렇게 붕 떠있진 않을 텐데 내일의 어둠이 저 달을 한 입 삼키면 둘이 만들었던 세계도 더 작아질 텐데 그리움만 꽉 차겠지 지루한 하루들을 보낸 후 보름달 하늘에 뜰 때쯤에는 우린 하나라고 떠들고 다닐 때만 해도 너는 너고 나는 나라는 게 이렇게도 명확해질지 몰랐어 서로 생각할 시간 시간 초과된 기분 더 지나면 서로 돌아오라고도 못 해 난 지금 돈키호테처럼 정처 없이 네 사랑을 꿈꾸네 난 네 눈만 봐도 텅 빈 이 맘을 다 채울 텐데 다 너의 반 반 반의 반의 반도 채워주질 못 하네 채워지지가 않네 Yeah 딱 너의 반 반 반의 반이라도 내게 남았더라면 이렇게 붕 떠있진 않을 텐데 Love love the stars Love love the moon 딱 너의 반 반 반의 반이라도 내게 남았더라면 그랬더라면
2016	몇 년 후에	R&B/Soul	오늘 지나 몇 년 후면 시간마저 떠난 후면 과연 서로가 각자가 되어 잘 살 수 있을까 그리워할 만큼 그리워하고 충분히 아파 보면 그땐 그 손 놓아줘야 해 무엇이 우리를 만나게 했으며 그 무엇을 이유로 떨어져 있는지 먼지 쌓인 기억과 젖은 눈 닦아내 가면서 날 탓할 만한 뭔가를 찾고 있어 모든 게 제자리를 찾아가겠지 태연한 척하는 내게 다들 속아주고 사랑의 부질없음에 대한 얘길 지껄여도 남 보기엔 가엾은 놈 흔히들 이런 걸 자유나 해방이라 해 틀렸어 구속은 이별한 후에 시작돼 대충 털고 일어날 수 있는 게 아니지 절대 당연하게 여긴 존재였기에 오늘 지나 몇 년 후면 시간마저 떠난 후면 과연 서로가 각자가 되어 잘 살 수 있을까 그리워할 만큼 그리워하고 충분히 아파 보면 그땐 그 손 놓아줘야 해 추억은 그 모습 그대로 늙지 않고 게을러터진 나 마음 정리가 안됐어 뒤돌아 살면서 내일 만큼 두려운 게 있을까 차라리 증오나 원망이었으면 그냥 소나긴 줄 알았어 잠시 젖었다 말라버릴 감정일 줄 알았어 근데 소심하지도 않은 나 널 잡아 꺼내려만 하면 속에 자꾸 담아둬 핑계만 늘어놔 더 어질러진 맘 을 추스르다 어느덧 흘러버린 밤을 절대 짐은 되기 싫다던 네가 이렇게 헤어짐을 남기고 떠나 오늘 지나 몇 년 후면 시간마저 떠난 후면 과연 서로가 각자가 되어 잘 살 수 있을까 그리워할 만큼 그리워하고 충분히 아파 보면 그땐 그 손 놓아줘야 해 너와 내 사인 더이상 우리라 불려질 수 없는 걸 며칠만 내게 며칠만 주어진다면 끌어안고 얘기할래 내가 미친놈이라 그래 멀쩡해 보이지만 이건 다 버티는거야 가장 소중한 부분을 어떻게 피 한방울 없이 떼어내 너가 가진 전부였던 난 지금 거렁뱅이 이렇게 버젓이 내 안에 살아 숨쉬는 널 무슨 수로 가슴에 묻어 오늘 지나 몇 년 후에 시간마저 떠난 후에 결국 서로가 혼자가 되면 알 수 있을거야 그리워할 만큼 그리워해도 잊지 못할 우리였음을
2016	Toy	R&B/Soul	내 감정 따위 뭐가 중요해 싫증 날 때까지 갖고 놀면 돼 널 위해서라면 날 부러뜨려도 좋아 because I'm a toy toy 쓸모 없어지면 버려 몰래 문득 어렴풋이라도 기억될 수만 있다면 나 Everything I do it for you I'm a toy toy 담아왔던 속 얘길 나눌 때면 날 어루만지고 나서야 미소를 지었던 너야 얼마 안 돼 구석에 놓이겠지만 이 운명은 네 소유인 걸 Girl use me while you can I'm all yours 난 너에게 더 이상 바랄게 없어 나로 인해 채워지는 널 본다면 꺼내줄 수 있어 다 가져가 주겠니 사랑이 장난이면 가차 없이 날 이용해 Now you know all you need is me I'm your toy I'm your toy I'm your toy 사랑이 장난이면 가차 없이 날 이용해 도대체 난 무엇일까 너한테 이런 질문도 욕심일까 나한텐 있는 거 없는 거 다 쏟아부었지만 소박한 기대조차 사치라 느껴진다 어차피 네 세상에서 한 발짝도 못 떼 아름답던 사이로 남아 추억 속에 진열되면 돼 네 마음 한적해지면 날 발견할 수 있어 사랑은 바보처럼 하는 게 현명할지도 아무 말도 해줄 수 없는 나 침묵하는 내 입술은 벌써 몇 장의 편지를 써냈어 나 하나쯤의 가벼운 아픔이지만 네가 슬퍼하길 원해 Girl use me while you can I'm all yours 난 너에게 더 이상 바랄게 없어 나로 인해 채워지는 널 본다면 꺼내줄 수 있어 다 가져가 주겠니 사랑이 장난이면 가차 없이 날 이용해 Now you know all you need is me I'm your toy 우린 평등할 수 없겠지 넌 내게 단 하나고 난 그 중 하나일 테니 주제넘지 않게끔만 헌신하면서 시작도 안 해본 이야길 마무리 지어 당장 타올라도 바람 앞의 촛불 널 밝힌 만큼 흐르는 눈물 이 달리길 갑자기 멈추면 난 분명히 넘어져 한 번만이라도 함께 걸어줘 난 너에게 더 이상 바랄게 없어 나로 인해 채워지는 널 본다면 꺼내줄 수 있어 다 가져가 주겠니 사랑이 장난이면 가차 없이 날 이용해 Now you know all you need is me I'm your toy I'm your toy I'm your toy 사랑이 장난이면 가차 없이 날 이용해
2016	MY STAR	R&B/Soul	넌 나의 STAR 넌 나의 SUN 넌 나의 MOON 세상을 다 가진 느낌 I FEEL I FEEL GOOD I FEEL GOOD WHEN I’M WITH YOU 넌 나의 ROCK 넌 나의 GUN 넌 나의 ROSE 감당이 안 돼 이 느낌 FEEL ALRIGHT 이제 안 외로워 나 안 외로워 첫사랑 같은 내 맘은 너를 향한 춤을 추고 OH OH OH 미친 것 같은 내 눈엔 한 사람만 보여 오직 YOU 시작한 사랑을 멈추지마 DON’T STOP 기나긴 밤은 너와 내거니까 YOU’RE MINE 지금 내 두 손을 잡고 NEVER LET ME GO TELL ME 너도 나와 같은 사랑한다고 넌 나의 STAR 넌 나의 SUN 넌 나의 MOON 세상을 다 가진 느낌 I FEEL I FEEL GOOD I FEEL GOOD WHEN I’M WITH YOU 넌 나의 POISON 넌 나의 TROUBLE 넌 나의 FATE 못 참겠어 OH 네 손길 FEEL ALRIGHT 네가 너무 좋아 나 너무 좋아 LISTEN SOMETHING ABOUT YOU 멈췄던 내 가슴을 뛰게 하고 OH OH OH 미친 것 같은 내 눈엔 한 사람만 보여 오직 YOU 시작한 사랑을 멈추지마 DON’T STOP 기나긴 밤은 너와 내거니까 YOU’RE MINE 지금 내 두 손을 잡고 NEVER LET ME GO TELL ME 너도 나와 같은 사랑한다고 어느새 난 영원을 꿈꾸곤 해 BUT NOTHING IS FOREVER I KNOW 너 없는 날 상상할 수조차 없어 넌 나의 STAR 넌 나의 SUN 넌 나의 MOON 세상을 다 가진 느낌 I FEEL I FEEL GOOD I FEEL GOOD WHEN I’M WITH YOU 넌 나의 ROCK 넌 나의 GUN 넌 나의 ROSE 감당이 안돼 이 느낌 FEEL ALRIGHT 이제 안 외로워 나 안 외로워
2016	우아해 (woo ah)	R&B/Soul	우아 우아 우아해 우아 우아 우아해 우아 우아 우아해 우아 우아 나른해요 그대 곁에 있을 때 콧노랠 부르게 해주네요 너무 아름다워 환하게 웃는 그 모습은 눈이 부시게 맑은 햇살 같아요 날 밝혀줘 baby woo I wanna fall in love with you 마음 가는 대로 해요 my baby 아무 걱정 말고 내 손을 잡아요 넌 우아 우아 우아해 우아 우아 우아해 우아 우아 우아해 우아 우아 우아해 우와 우와 우와해 우와 우와 우와해 우와 우와 우와해 우와 우와 멈추기 싫어요 이 노랠 부를 땐 아무것도 신경쓰기 싫어요 woo yeah 내 옆에 잠이든 너의 모습을 그려 I want it 매일 아침 일어나 말하고 싶어 babe have a good morning I just wanna be with you oh yeah 눈 부시게 맑은 햇살이 비출 때 I wanna fall in love with you 마음 가는 대로 해요 my baby 아무 걱정 말고 내 손을 잡아요 넌 우아 우아 우아해 우아 우아 우아해 우아 우아 우아해 우아 우아 우아해 우와 우와 우와해 우와 우와 우와해 우와 우와 우와해 우와 우와 하얀색 피부 앙증맞은 코에 부드러운 머리 결 날 내려보네 널 안으면 내 맘까지 따뜻해지곤 해 내 어깨에 기대면 잠이 막 쏟아지네 날 올려다보는 니 입술이 마침내 like a bomb on me 기분은 점차 높아지고 우린 반올림 Do you love me Like I love you Do you love me Like I love you
2016	쏘쏘	R&B/Soul	눈이 높은 건 절대 아닌데 딱히 맘이 끌리지가 않아 한두 번 만나보고 며칠을 연락해도 어색한 공기만 흐를 뿐 참 답답해 이상해 자꾸 어긋나는 일 대체 뭐가 문젤까 누굴 만나도 so so 혼자인 것도 so so 설레이지도 나쁘지도 않은 기분 so so 감을 잃어가 점점 사랑은 어떻게 하는 거였더라 기억도 잘 안 나 커플들이 부럽기는 해도 좋겠다 혼자인 게 외롭지는 않아 견딜만해 한가로운 내 전화 약속도 없는 주말 TV 앞의 내가 싫을 뿐 참 궁금해 신기해 사랑에 빠지는 일 나만 빼고 전부 다 누굴 만나도 so so 혼자인 것도 so so 설레이지도 나쁘지도 않은 기분 so so 감을 잃어가 점점 사랑은 어떻게 하는 거였더라 어디서 뭐 하냐고 태어나긴 했냐고 이제는 좀 나타나줘 내 맘 줄 사람 보자마자 안아주고 싶어 노력해 봐도 so so 애를 써봐도 so so 감동이 없고 재미없고 그저 그래 so so so so 기억도 안 나 덤덤 가슴이 뛰어본 게 언제쯤 일까 나도 누군갈 좋아해 보고 싶어 사랑하고 싶어
2016	바라지 않아 (Feat. 소정 Of 레이디스 코드)	R&B/Soul	창 밖에 비가 내릴 때면 옛 생각에 잠기곤 해 나 헤어졌다는 게 실감이 안나서 홀로 남았단 게 서투른 오늘 같은 밤 벌써 니가 그리워진 건지 아님 괜히 외로웠는지 어질어진 맘은 식을 줄 모르고 하루하루가 왜 힘들기만 하는지 처음 만나 설렜던 그 날처럼 뜨겁게 안았던 그 날처럼 이젠 두 번 다시 돌릴 수 없는 걸 우린 잘 알잖아 더는 바라지 않아 기억하니 쉬웠던 시작이 늘 난 두려웠었다고 사랑하니까 좋았으니까 You 널 울리진 않을까 아무것도 할 수 없어 힘들기만 했는데 처음 만나 설렜던 그 날처럼 뜨겁게 안았던 그 날처럼 이젠 두 번 다시 돌릴 수 없는 걸 우린 잘 알잖아 더는 바라지 않아 다 지난 일인 걸 알면서도 왜 왜 막연한 바램에 끝내 널 부르는지 처음 만나 설렜던 그 날처럼 뜨겁게 안았던 그 날처럼 예전처럼 곁에만 있어줘 Oh ma Baby 사랑할 수 있어 다시 한 번 내게 기회를 준다면 더는 바라지 않아 처음 만나 설렜던 그 날처럼 뜨겁게 안았던 그 날처럼 Baby 뜨거웠던 날처럼 사랑할 수 있어 다시 한 번 내게 기회를 준다면 더는 바라지 않아 이젠 알 것 같아 내겐 너 뿐 이란 걸
2016	Bye bye my blue	R&B/Soul	난 왜 니가 가진 것들을 부러워하는 걸까 감당하지도 못할 것들을 손에 꼭 쥐고서 여기서 무얼 얼만큼 더 나아지고픈 걸까 너도 똑같은 거 다 아는데 내가 이기적인 걸까 많이 가져도 난 아직 너 같진 않아 아픈 기억들 위로 매일 혼자 걸어 난 아플걸 알아도 자꾸 마음이 가나 봐 그래서 자꾸 네게 욕심을 내나 봐 나의 나의 나의 그대여 이름만 불러봐도 맘이 벅차요 난 더욱 더욱 더욱 크게 되어 널 가득 안고 싶고 그래요 하고 싶은 말을 하는 게 불안해서 너를 밀어내고서 불편하게 만들어 듣고 싶은 말이 너무나 많은데도 바라지를 못하고 마음 아프게 기다려 나의 나의 나의 그대여 이름만 불러봐도 맘이 벅차요 난 더욱 더욱 더욱 크게 되어 널 가득 안고 싶고 그래요
2016	비	R&B/Soul	비가 내리다 말다 우산을 챙길까 말까 tv엔 맑음이라던데 네 마음도 헷갈리나봐 비가 또 내리다 말다 하늘도 우울한가봐 비가 그치고나면 이번엔 내가 울것만같아 Strumming down to my memories 지직거리는 라디오에선 또 뻔한 love song 잊고있던 아픈 설레임 널 생각나게해 우리 걷던 이길위에 흘러나오던 멜로디 흥얼거렸었지 넌 어디있니 하늘은 이렇게 맑은데 비에 젖은 내 마음을 따뜻하게도 비춰주던 너는 나에게 햇살같아 그런널 왜 난 보냈을까 Good bye So hard to lose but easy to repeat 푹 숙인 얼굴 날 알아봤을까 I'm losing my breathe 잊고 싶던 아픈 기억들 날 더 힘들게해 시간가는 줄도 모르고 나눴던 수많은 밤과 사랑노래 꿈보다 달콤했지 쉽게 포기한건아닌지 우연히널 마주친 순간 내 마음 들킬까봐 뒤돌아섰어 널 잡았다면 그런 널 왜 난 보냈을까 우리 걷던 이길위에 흘러나오던 멜로디 흥얼거렸었지 넌 어디있니 하늘은 이렇게 맑은데 비에 젖은 내 마음을 따뜻하게도 비춰주던 너는 나에게 햇살같아 그런널 왜 난 보냈을까 Good bye
2016	No Doubt (노답)	R&B/Soul	I love you girl I love you more than me My sweet heart don't hate me 있잖아 미안해 다신 아프게 안 할게 꿈이길 바랬어 겨우 침대 위에 너무 많은 생각들 내 고민들 하루만 더 내게 달라고 졸라봤어도 단칼 같던 넌 그저 혼자 밤을 맞으래 leave me alone 눈을 뜨면 여긴 나의 판타지 우물쭈물 하면 현실로 다시 떨어지네 I love you baby so much no doubt Here we are you crazy yeah we crazy I love you girl I love you more than me My sweet heart don't hate me 있잖아 미안해 다신 아프게 안 할게 그대는 눈물의 성을 쌓으래 맘은 아픈데 촉이 맞나 봐 떠나려나 봐 난 버려지나 봐 아무렇지 않게 찢어버린 우리 시간 영원히 멈출 것만 같아 내 심장 한 번쯤 내 생각해줄까 조금 후에 우리 다시 돌아갈 순 없을까 이렇게 못해 못 가 널 못 보내 I love you ye I love you ye this is me 아직도 넌 말하죠 지금이라 말하죠 하지만 떠날 수 없어요 그대의 작은 손 놓기가 싫어요 잠시만 이대로 있어 I love you girl I love you more than me My sweet heart don't hate me 있잖아 미안해 다신 아프게 안 할게 I love you girl I love you more than me My sweet heart don't hate me 있잖아 미안해 다신 아프게 안 할게 
